0,Lopez misses UK charity premiere,entertainment
1,Music mogul Fuller sells company,entertainment
2,Hobbit picture 'four years away',entertainment
3,US 'to raise TV indecency fines',entertainment
4,Surprise win for anti-Bush film,entertainment
5,No UK premiere for Rings musical,entertainment
6,Volcano drama erupts on BBC One,entertainment
7,Pupils to get anti-piracy lessons,entertainment
8,De Niro completes box office coup,entertainment
9,Sideways dominates Spirit awards,entertainment
10,Hundreds vie for best film Oscar,entertainment
11,TOTP turns to Elvis impersonator,entertainment
12,Famed music director Viotti dies,entertainment
13,Da Vinci film to star Tom Hanks,entertainment
14,New York rockers top talent poll,entertainment
15,Rapper Snoop Dogg sued for 'rape',entertainment
16,Church anger over Bollywood film,entertainment
17,West End to honour finest shows,entertainment
18,Eurovision 'greats' to do battle,entertainment
19,Brits return Keane to number one,entertainment
20,Incredibles win animation awards,entertainment
21,Mogul Wilson backing UK rap band,entertainment
22,Rap boss arrested over drug find,entertainment
23,Hollywood ready for Oscars night,entertainment
24,TV station refuses adoption show,entertainment
25,Oscars steer clear of controversy,entertainment
26,Dirty Den's demise seen by 14m,entertainment
27,Halloween writer Debra Hill dies,entertainment
28,Snow Patrol feted at Irish awards,entertainment
29,Wine comedy wins critics' award,entertainment
30,Spider-Man creator wins profits,entertainment
31,Spector facing more legal action,entertainment
32,Mutant book wins Guardian prize,entertainment
33,Muslim group attacks TV drama 24,entertainment
34,German music in a 'zombie' state,entertainment
35,Top stars join US tsunami TV show,entertainment
36,Greer attacks 'bully' Big Brother,entertainment
37,US actor 'found with gun residue',entertainment
38,Usher leads Soul Train shortlist,entertainment
39,Tarantino to direct CSI episode,entertainment
40,Aviator and Vera take Bafta glory,entertainment
41,Media seek Jackson 'juror' notes,entertainment
42,Career honour for actor DiCaprio,entertainment
43,Dutch watch Van Gogh's last film,entertainment
44,Da Vinci Code is 'lousy history',entertainment
45,Jugnot 'tops French actor league',entertainment
46,Police praise 'courageous' Ozzy,entertainment
47,Celebrities get to stay in jungle,entertainment
48,Levy takes Whitbread novel prize,entertainment
49,Arnold congratulated on Oscar win,entertainment
50,Rapper Kanye West's shrewd soul,entertainment
51,Usher leads Billboard nominations,entertainment
52,Scissor Sisters triumph at Brits,entertainment
53,Musical treatment for Capra film,entertainment
54,Oasis star fined for German brawl,entertainment
55,BBC 'should allow more scrutiny',entertainment
56,Elvis set to top UK singles chart,entertainment
57,Pop band Busted to 'take a break',entertainment
58,BBC to pour £9m into new comedy,entertainment
59,Arthur Hailey: King of the bestsellers,entertainment
60,Star Trek fans fight to save show,entertainment
61,Smith loses US box office crown,entertainment
62,Spears seeks aborted tour payment,entertainment
63,Lost Doors frontman movie found,entertainment
64,Dance music not dead says Fatboy,entertainment
65,Sundance to honour foreign films,entertainment
66,Eastwood's Baby scoops top Oscars,entertainment
67,Doves soar to UK album summit,entertainment
68,Ethnic producers 'face barriers',entertainment
69,Campaigners attack MTV 'sleaze',entertainment
70,Housewives lift Channel 4 ratings,entertainment
71,Rocker Doherty in on-stage fight,entertainment
72,DVD review: I Robot,entertainment
73,'My memories of Marley...',entertainment
74,Foxx and Swank win US awards,entertainment
75,Carry On star Patsy Rowlands dies,entertainment
76,School tribute for TV host Carson,entertainment
77,Douglas set for Indian adventure,entertainment
78,Oscars race enters final furlong,entertainment
79,Elvis fans hold birthday bash,entertainment
80,Alicia Keys to open US Super Bowl,entertainment
81,Rock band U2 break ticket record,entertainment
82,Fantasy book wins Hollywood deal,entertainment
83,Shark Tale DVD is US best-seller,entertainment
84,'Landmark movies' of 2004 hailed,entertainment
85,Bafta to hand out movie honours,entertainment
86,The Sound of Music is coming home,entertainment
87,Baby becomes new Oscar favourite,entertainment
88,Legendary music studio to close,entertainment
89,Prince crowned 'top music earner',entertainment
90,Tautou film tops Cesar prize nods,entertainment
91,Indie film nominations announced,entertainment
92,Springer criticises Opera musical,entertainment
93,Goodrem wins top female MTV prize,entertainment
94,Howl helps boost Japan's cinemas,entertainment
95,Comic Morris returns with sitcom,entertainment
96,Elvis regains top chart position,entertainment
97,Ocean's Twelve raids box office,entertainment
98,J-Lo and husband plan debut duet,entertainment
99,REM announce new Glasgow concert,entertainment
100,Singer Christina Aguilera to wed,entertainment
101,Stars pay tribute to actor Davis,entertainment
102,TV show unites Angolan families,entertainment
103,Jackson film 'absolute disaster',entertainment
104,De Niro film leads US box office,entertainment
105,Lit Idol begins search for author,entertainment
106,Paraguay novel wins US book prize,entertainment
107,Berlin applauds Hotel Rwanda,entertainment
108,Boogeyman takes box office lead,entertainment
109,Horror film heads US box office,entertainment
110,Day-Lewis set for Berlin honour,entertainment
111,Actress Roberts takes spider role,entertainment
112,US TV special for tsunami relief,entertainment
113,Fears raised over ballet future,entertainment
114,UK Directors Guild nominees named,entertainment
115,Berlin honours S Korean director,entertainment
116,Potter director signs Warner deal,entertainment
117,Glastonbury fans to get ID cards,entertainment
118,Applegate's Charity show closes,entertainment
119,Belle named 'best Scottish band',entertainment
120,Gallery unveils interactive tree,entertainment
121,Snicket tops US box office chart,entertainment
122,US TV host Clark suffers stroke,entertainment
123,Bening makes awards breakthrough,entertainment
124,Singer's film to show at festival,entertainment
125,Wife Swap makers sue US 'copycat',entertainment
126,Film star Fox behind theatre bid,entertainment
127,Willis sues over movie 'injury',entertainment
128,Casino Royale is next Bond movie,entertainment
129,Rapper 50 Cent ends protege feud,entertainment
130,Brookside creator's Channel 4 bid,entertainment
131,Roxy Music on Isle of Wight bill,entertainment
132,Wal-Mart is sued over rude lyrics,entertainment
133,Little Britain two top comic list,entertainment
134,Queen recruit singer for new tour,entertainment
135,Children vote Shrek 2 best film,entertainment
136,Rapper Jay-Z becomes label boss,entertainment
137,Label withdraws McFadden's video,entertainment
138,Russian film wins BBC world prize,entertainment
139,Oscar host Rock to keep it clean,entertainment
140,Low-budget film wins Cesar,entertainment
141,Court halts Mark Morrison album,entertainment
142,Manics in charge of BBC 6 Music,entertainment
143,Briton wins short film Oscar,entertainment
144,Fightstar take to the stage,entertainment
145,TV presenter Deeley drops CD:UK,entertainment
146,Artists' secret postcards on sale,entertainment
147,Tarantino 'to make Friday sequel',entertainment
148,Fox 'too reliant on reality TV',entertainment
149,Row threatens Hendrix museum plan,entertainment
150,Grammys honour soul star Charles,entertainment
151,Buffy creator joins Wonder Woman,entertainment
152,George Michael to perform for BBC,entertainment
153,Aviator 'creator' in Oscars snub,entertainment
154,Box office blow for Alexander,entertainment
155,Double eviction from Big Brother,entertainment
156,Stern dropped from radio stations,entertainment
157,Johnny and Denise lose Passport,entertainment
158,Musicians to tackle US red tape,entertainment
159,Oscar nominee Dan O'Herlihy dies,entertainment
160,X Factor show gets second series,entertainment
161,British stars denied major Oscars,entertainment
162,Early Elvis recordings go on sale,entertainment
163,Cult band Kasabian surge forward,entertainment
164,Brits debate over 'urban' music,entertainment
165,Women in film 'are earning less',entertainment
166,Abba queen enters music rich list,entertainment
167,Uganda bans Vagina Monologues,entertainment
168,Dame Julie pops in to see Poppins,entertainment
169,Super Size Me wins writers' award,entertainment
170,&#163;1.8m indecency fine for Viacom,entertainment
171,Abba reunite for musical premiere,entertainment
172,Bookmakers back Aviator for Oscar,entertainment
173,Slater to star in Broadway play,entertainment
174,Hollywood hunts hits at Sundance,entertainment
175,Redford's vision of Sundance,entertainment
176,Baywatch dubbed 'worst TV import',entertainment
177,Snow Patrol bassist exits group,entertainment
178,Veteran comic Cyril Fletcher dies,entertainment
179,India to deport Bollywood actress,entertainment
180,Band Aid retains number one spot,entertainment
181,Disputed Nirvana box set on sale,entertainment
182,Rapper 50 Cent scores chart first,entertainment
183,Spark heads world Booker list,entertainment
184,Adventure tale tops awards,entertainment
185,UK's National Gallery in the pink,entertainment
186,Bollywood draws global stars,entertainment
187,Public show for Reynolds portrait,entertainment
188,Bets off after Big Brother 'leak',entertainment
189,Foxx and Swank take actors awards,entertainment
190,Wine comedy up for six film gongs,entertainment
191,Farrell due to make US TV debut,entertainment
192,Pixies take on Reading and Leeds,entertainment
193,Aaliyah claim dismissed by court,entertainment
194,Three DJs replace Peel radio show,entertainment
195,Downloads enter US singles chart,entertainment
196,Famed music director Viotti dies,entertainment
197,Youssou N'Dour wins music prize,entertainment
198,New Harry Potter tops book chart,entertainment
199,Fockers retain film chart crown,entertainment
200,Aviator 'creator' in Oscars snub,entertainment
201,Obituary: Dame Alicia Markova,entertainment
202,Ring of Fire hit co-writer dies,entertainment
203,Ocean's Twelve raids box office,entertainment
204,T in the Park sells out in days,entertainment
205,France set for new Da Vinci novel,entertainment
206,Singer Knight backs anti-gun song,entertainment
207,Patti Smith to host arts festival,entertainment
208,Roundabout continues nostalgia trip,entertainment
209,UK debut for Kevin Spacey movie,entertainment
210,Jungle TV show ratings drop by 4m,entertainment
211,OutKast win at MTV Europe Awards,entertainment
212,Howl helps boost Japan's cinemas,entertainment
213,Rock group Korn's guitarist quits,entertainment
214,Portishead back after eight years,entertainment
215,Film row over Pirates 'cannibals',entertainment
216,The Producers scoops stage awards,entertainment
217,BBC denies Blackadder TV comeback,entertainment
218,iTunes now selling Band Aid song,entertainment
219,Tough schedule delays Elliot show,entertainment
220,Bollywood DVD fraudster is jailed,entertainment
221,Fockers fuel festive film chart,entertainment
222,De Niro film leads US box office,entertainment
223,U2's desire to be number one,entertainment
224,US box office set for record high,entertainment
225,Ray DVD beats box office takings,entertainment
226,Hoffman hits out over modern film,entertainment
227,No charges against TV's Cosby,entertainment
228,Angels 'favourite funeral song',entertainment
229,Ray DVD beats box office takings,entertainment
230,John Peel replacement show begins,entertainment
231,Tautou 'to star in Da Vinci film',entertainment
232,Kidman wins photographer battle,entertainment
233,No ads for Passion Oscar campaign,entertainment
234,Brits return Keane to number one,entertainment
235,'Comeback' show for Friends star,entertainment
236,U2 to play at Grammy awards show,entertainment
237,Soul sensation ready for awards,entertainment
238,Berlin hails European cinema,entertainment
239,Streets have 'album of the year',entertainment
240,Deal to ban 'homophobic' reggae,entertainment
241,Band Aid 20 single storms to No 1,entertainment
242,Levy tipped for Whitbread prize,entertainment
243,Singer Ferguson 'facing eviction',entertainment
244,Top of the Pops leaves BBC One,entertainment
245,New media battle for Bafta awards,entertainment
246,Sir Paul rocks Super Bowl crowds,entertainment
247,French honour for director Parker,entertainment
248,Jamelia's return to the top,entertainment
249,Lee to create new film superhero,entertainment
250,Ten-year tragedy of missing Manic,entertainment
251,Animation charms Japan box office,entertainment
252,Help for indies in download sales,entertainment
253,Brit awards for Devon music acts,entertainment
254,Sky takes over Oscar night mantle,entertainment
255,Britney attacks 'false tabloids',entertainment
256,Rap feud in 50 Cent's G-Unit crew,entertainment
257,Day-Lewis set for Berlin honour,entertainment
258,Actor Foxx sees Globe nominations,entertainment
259,Vibe awards back despite violence,entertainment
260,Beastie Boys win sampling battle,entertainment
261,How the Academy Awards flourished,entertainment
262,Godzilla gets Hollywood fame star,entertainment
263,Van Gogh festival film withdrawn,entertainment
264,Top gig award for Scissor Sisters,entertainment
265,Sir Paul rocks Super Bowl crowds,entertainment
266,Triple triumph for Little Britain,entertainment
267,New York rockers top talent poll,entertainment
268,US TV cuts nudity from BBC film,entertainment
269,Hard act to follow for OutKast,entertainment
270,Prince crowned 'top music earner',entertainment
271,Eminem beats Elvis to number one,entertainment
272,Fry set for role in Hitchhiker's,entertainment
273,Lasting influence of legend Charles,entertainment
274,UK TV channel rapped for CSI ad,entertainment
275,Baghdad Blogger on big screen,entertainment
276,US critics laud comedy Sideways,entertainment
277,Little Britain vies for TV trophy,entertainment
278,Vera Drake leads UK Oscar hopes,entertainment
279,REM concerts blighted by illness,entertainment
280,Moreno debut makes Oscar mark,entertainment
281,US composer recreates Bach score,entertainment
282,Rapper films music video in jail,entertainment
283,Black Sabbath top rock album poll,entertainment
284,The comic book genius of Stan Lee,entertainment
285,Holmes wins '2004 top TV moment',entertainment
286,Hanks greeted at wintry premiere,entertainment
287,Vera Drake scoops film award,entertainment
288,A-listers flock to Gervais sitcom,entertainment
289,Mumbai bombs movie postponed,entertainment
290,Spike Lee backs student directors,entertainment
291,Poppins musical gets flying start,entertainment
292,'Christmas song formula' unveiled,entertainment
293,Actor Scott is new Bond favourite,entertainment
294,Queen recruit singer for new tour,entertainment
295,Brando 'rejected Godfather role',entertainment
296,Films on war triumph at Sundance,entertainment
297,DVD review: Spider-Man 2,entertainment
298,Berlin celebrates European cinema,entertainment
299,Robots march to US cinema summit,entertainment
300,Versace art portfolio up for sale,entertainment
301,DJ double act revamp chart show,entertainment
302,Bennett play takes theatre prizes,entertainment
303,Original Exorcist to be screened,entertainment
304,Oscar nominees lack pulling power,entertainment
305,Russian film wins BBC world prize,entertainment
306,Download chart debut is delayed,entertainment
307,Parker's saxophone heads auction,entertainment
308,No jail for singer Courtney Love,entertainment
309,Last Star Wars 'not for children',entertainment
310,Pop band Busted to 'take a break',entertainment
311,Eminem secret gig venue revealed,entertainment
312,Stallone evicted from Big Brother,entertainment
313,God cut from Dark Materials film,entertainment
314,US show sued for rat-eating stunt,entertainment
315,DVD review: Harry Potter and the Prisoner of Azkaban,entertainment
316,Church urges Nelly show boycott,entertainment
317,US 'afflicted' with awards fatigue,entertainment
318,Branson show flops on US screens,entertainment
319,Corbett attacks 'dumbed-down TV',entertainment
320,Stars shine on Bafta red carpet,entertainment
321,Oscar nominees gear up for lunch,entertainment
322,Celebrities get their skates on,entertainment
323,Berlin cheers for anti-Nazi film,entertainment
324,Bangkok film festival battles on,entertainment
325,Richard and Judy choose top books,entertainment
326,Rock star sued by ex-girlfriend,entertainment
327,Stars pay tribute to actor Davis,entertainment
328,Jarre joins fairytale celebration,entertainment
329,Bookmakers back Aviator for Oscar,entertainment
330,Prodigy join V Festival line-up,entertainment
331,Brookside actress Keaveney dies,entertainment
332,Hitch holds on to US box office,entertainment
333,Joy Division story to become film,entertainment
334,McCririck out of Big Brother show,entertainment
335,Musical treatment for Capra film,entertainment
336,EastEnders 'is set for US remake',entertainment
337,UK 'world's biggest music buyer',entertainment
338,Stars gear up for Bafta ceremony,entertainment
339,Hillbillies singer Scoggins dies,entertainment
340,Connick Jr to lead Broadway show,entertainment
341,Global release for Japan hit film,entertainment
342,Chris Evans back on the market,entertainment
343,Byrds producer Melcher dies at 62,entertainment
344,Michael film signals 'retirement',entertainment
345,Blair buys copies of new Band Aid,entertainment
346,Fockers keeps US box office lead,entertainment
347,Controversial film tops festival,entertainment
348,Charity single for quake relief,entertainment
349,Franz man seeks government help,entertainment
350,Double win for Sea Inside,entertainment
351,Blue beat U2 to top France honour,entertainment
352,Spirit awards hail Sideways,entertainment
353,CSI shows give 'unrealistic view',entertainment
354,Singer Sizzla jailed for swearing,entertainment
355,US actor Ossie Davis found dead,entertainment
356,Beatles suits sell for $110000,entertainment
357,Elvis 'set for chart hat-trick',entertainment
358,Glasgow hosts tsunami benefit gig,entertainment
359,Keanu Reeves given Hollywood star,entertainment
360,Cage film's third week at US top,entertainment
361,Neeson in bid to revive theatre,entertainment
362,Tautou 'to star in Da Vinci film',entertainment
363,Franz Ferdinand's art school lesson,entertainment
364,Director Nair's Vanity project,entertainment
365,South Bank Awards honour hit soap,entertainment
366,Show over for MTV's The Osbournes,entertainment
367,Duran Duran show set for US TV,entertainment
368,Vera Drake's Bafta triumph hope,entertainment
369,Singer Ian Brown 'in gig arrest',entertainment
370,Music man to the Oscars,entertainment
371,US charity anthem is re-released,entertainment
372,Johnny Depp: The acting outlaw,entertainment
373,U2 stars enter rock Hall of Fame,entertainment
374,Downloads enter US singles chart,entertainment
375,Johnny Cash manager Holiff dies,entertainment
376,Housewives lift Channel 4 ratings,entertainment
377,Ray Charles studio becomes museum,entertainment
378,Hendrix guitar fetches £100000,entertainment
379,Aviator wins top Globes accolades,entertainment
380,Film production 'falls' 40% in UK,entertainment
381,Gervais writing Simpsons episode,entertainment
382,Elton plays Paris charity concert,entertainment
383,Pete Doherty misses bail deadline,entertainment
384,Singer's film to show at festival,entertainment
385,Critics back Aviator for Oscars,entertainment
386,Player burn-out worries Robinson,sport
387,Lions blow to World Cup winners,sport
388,Pountney handed ban and fine,sport
389,Lions blow to World Cup stars,sport
390,Boro suffer Morrison injury blow,sport
391,Moya clinches Cup for Spain,sport
392,Safin relieved at Aussie recovery,sport
393,Moyes U-turn on Beattie dismissal,sport
394,London Irish 19-33 Wasps,sport
395,Mansfield 0-1 Leyton Orient,sport
396,Palace threat over Cantona masks,sport
397,Moya suffers shock loss,sport
398,Castaignede fires Laporte warning,sport
399,Robinson wants dual code success,sport
400,Clijsters hope on Aussie Open,sport
401,Collins banned in landmark case,sport
402,Wenger rules out new keeper,sport
403,Greek pair attend drugs hearing,sport
404,Ronaldo considering new contract,sport
405,McClaren targets Champions League,sport
406,Henin-Hardenne beaten on comeback,sport
407,Giggs handed Wales leading role,sport
408,Tulu to appear at Caledonian run,sport
409,Llewellyn plans Wales retirement,sport
410,Moya sidesteps Davis Cup in 2005,sport
411,Hansen 'delays return until 2006',sport
412,Mourinho receives Robson warning,sport
413,Roddick splits from coach Gilbert,sport
414,Injury sidelines Philippoussis,sport
415,Injury doubts beset Wales squad,sport
416,Harinordoquy suffers France axe,sport
417,Bomb threat at Bernabeu stadium,sport
418,Vickery upbeat about arm injury,sport
419,Kenyon denies Robben Barca return,sport
420,McIlroy continues winning streak,sport
421,Prutton poised for lengthy FA ban,sport
422,Robinson answers critics,sport
423,Sprinter Walker quits athletics,sport
424,Ireland v USA (Sat),sport
425,Premier League planning Cole date,sport
426,Balco case trial date pushed back,sport
427,Federer forced to dig deep,sport
428,Wilkinson to miss Ireland match,sport
429,Ref stands by Scotland decisions,sport
430,Legendary Dutch boss Michels dies,sport
431,Dent continues Adelaide progress,sport
432,Taylor poised for Scotland return,sport
433,UK Athletics agrees new kit deal,sport
434,Tevez - an Argentine in Brazil,sport
435,Henry tipped for Fifa award,sport
436,Desailly backs Blues revenge trip,sport
437,Mutu to hold talks with Juventus,sport
438,FA decides not to punish Mourinho,sport
439,Wales hails new superstar,sport
440,Federer joins all-time greats,sport
441,Souness eyes summer move for Owen,sport
442,Williams stays on despite dispute,sport
443,Wales want rugby league training,sport
444,Sydney to host north v south game,sport
445,Clyde 0-5 Celtic,sport
446,Prop Jones ready for hard graft,sport
447,Safin slumps to shock Dubai loss,sport
448,What now for Kelly Holmes?,sport
449,Off-colour Gardener storms to win,sport
450,What now for British tennis?,sport
451,Trial date is set for Balco case,sport
452,Benitez issues warning to Gerrard,sport
453,Ferguson urges Henry punishment,sport
454,Kenya lift Chepkemei's suspension,sport
455,All Black magic: New Zealand rugby,sport
456,Henman & Murray claim LTA awards,sport
457,Farrell saga to drag on - Lindsay,sport
458,Roche 'turns down Federer offer',sport
459,Benitez deflects blame from Dudek,sport
460,Jol joy at 'professional' Cup win,sport
461,Old Firm pair handed suspensions,sport
462,Greene sets sights on world title,sport
463,Reyes tricked into Real admission,sport
464,Healey targets England comeback,sport
465,Santini resigns as Spurs manager,sport
466,Parry firm over Gerrard,sport
467,Clijsters set for February return,sport
468,Newcastle 2-1 Bolton,sport
469,White prepared for battle,sport
470,Henman hopes ended in Dubai,sport
471,Clijsters could play Aussie Open,sport
472,Scotland 18-10 Italy,sport
473,Verdict delay for Greek sprinters,sport
474,Mourinho expects fight to finish,sport
475,Wales win in Rome,sport
476,Real will finish abandoned match,sport
477,England claim Dubai Sevens glory,sport
478,England given tough Sevens draw,sport
479,Bees handed potential Man Utd tie,sport
480,Man City 0-2 Man Utd,sport
481,WRU proposes season overhaul,sport
482,McCall earns Tannadice reprieve,sport
483,Klinsmann issues Lehmann warning,sport
484,Venus stunned by Farina Elia,sport
485,Adriano's Chelsea link rejected,sport
486,Reaction from Spanish press,sport
487,Connors' rallying cry for British tennis,sport
488,Mexicans tracking unhappy Juninho,sport
489,Holmes is hit by hamstring injury,sport
490,Barcelona title hopes hit by loss,sport
491,IAAF to rule on Greek sprint pair,sport
492,Wales critical of clumsy Grewcock,sport
493,McClaren hails Boro's Uefa spirit,sport
494,Campese berates whingeing England,sport
495,IAAF will contest Greek decision,sport
496,Redknapp poised for Saints,sport
497,Beattie return calms attack fears,sport
498,Chelsea ridiculed over complaint,sport
499,Double injury blow strikes Wales,sport
500,Dominici backs lacklustre France,sport
501,Ruddock backs Yapp's credentials,sport
502,Greek pair set for hearing,sport
503,Wales get Williams fitness boost,sport
504,Celtic unhappy over Bulgaria date,sport
505,Butler strikes gold in Spain,sport
506,Bosvelt optimistic over new deal,sport
507,Dunne keen to commit to Man City,sport
508,Rusedski angry over supplements,sport
509,Holmes urged to compete at Worlds,sport
510,Gardener wins double in Glasgow,sport
511,Redknapp's Saints face Pompey tie,sport
512,Yachvili savours France comeback,sport
513,Radcliffe eyes hard line on drugs,sport
514,Unclear future for striker Baros,sport
515,FA charges Liverpool and Millwall,sport
516,O'Connell rejects Lions rumours,sport
517,Pavey focuses on indoor success,sport
518,Rangers seal Old Firm win,sport
519,Laporte tinkers with team,sport
520,England 17-18 France,sport
521,Bellamy fined after row,sport
522,Nadal puts Spain 2-0 up,sport
523,Collins named UK Athletics chief,sport
524,Jansen suffers a further setback,sport
525,Dallaglio his own man to the end,sport
526,Bortolami predicts dour contest,sport
527,Martinez sees off Vinci challenge,sport
528,Holmes feted with further honour,sport
529,Chepkemei joins Edinburgh line-up,sport
530,Hingis hints at playing comeback,sport
531,Kenteris denies faking road crash,sport
532,Ireland 21-19 Argentina,sport
533,Gebrselassie in London triple bid,sport
534,Gerrard plays down European hopes,sport
535,Italy 17-28 Ireland,sport
536,Juninho demand for O'Neill talks,sport
537,Holmes secures comeback victory,sport
538,Ireland 17-12 South Africa,sport
539,Ireland 19-13 England,sport
540,Radcliffe enjoys winning comeback,sport
541,Campbell to extend sprint career,sport
