1697,Hyundai to build new India plant,business
1698,Italy to get economic action plan,business
1699,Nortel in $300m profit revision,business
1700,Pernod takeover talk lifts Domecq,business
1701,Ukraine revisits state sell-offs,business
1702,Euro firms miss out on optimism,business
1703,Fosters buys stake in winemaker,business
1704,Two Nigerian banks set to merge,business
1705,Troubled Marsh under SEC scrutiny,business
1706,Qatar and Shell in $6bn gas deal,business
1707,Cairn Energy in Indian gas find,business
1708,BMW drives record sales in Asia,business
1709,Banker loses sexism claim,business
1710,China had role in Yukos split-up,business
1711,US to probe airline travel chaos,business
1712,Weak end-of-year sales hit Next,business
1713,India's rupee hits five-year high,business
1714,Iraqi voters turn to economic issues,business
1715,Japan narrowly escapes recession,business
1716,Cash gives way to flexible friend,business
1717,Go-ahead for Balkan oil pipeline,business
1718,Barclays shares up on merger talk,business
1719,Disney settles disclosure charges,business
1720,SBC plans post-takeover job cuts,business
1721,Yukos sues four firms for $20bn,business
1722,S Korea spending boost to economy,business
1723,US retail sales surge in December,business
1724,US trade gap ballooned in October,business
1725,Ban on forced retirement under 65,business
1726,Pension hitch for long-living men,business
1727,Bank voted 8-1 for no rate change,business
1728,Sales 'fail to boost High Street',business
1729,US economy shows solid GDP growth,business
1730,Ailing EuroDisney vows turnaround,business
1731,South African car demand surges,business
1732,Mixed reaction to Man Utd offer,business
1733,US Airways staff agree to pay cut,business
1734,Swiss cement firm in buying spree,business
1735,Rich grab half Colombia poor fund,business
1736,Axa Sun Life cuts bonus payments,business
1737,Trial begins of Spain's top banker,business
1738,Takeover offer for Sunderland FC,business
1739,Russia WTO talks 'make progress',business
1740,Stormy year for property insurers,business
1741,Asia shares defy post-quake gloom,business
1742,Mexican in US send $16bn home,business
1743,India and Iran in gas export deal,business
1744,Qwest may spark MCI bidding war,business
1745,French wine gets 70m euro top-up,business
1746,Retail sales show festive fervour,business
1747,High fuel prices hit BA's profits,business
1748,US in EU tariff chaos trade row,business
1749,Low-cost airlines hit Eurotunnel,business
1750,BT offers equal access to rivals,business
1751,S Korea spending boost to economy,business
1752,Dollar gains on Greenspan speech,business
1753,Bush to get 'tough' on deficit,business
1754,Stock market eyes Japan recovery,business
1755,Cairn shares up on new oil find,business
1756,Durex maker SSL awaits firm bid,business
1757,Tsunami 'to hit Sri Lanka banks',business
1758,Dollar drops on reserves concerns,business
1759,Markets signal Brazilian recovery,business
1760,House prices suffer festive fall,business
1761,Diageo to buy US wine firm,business
1762,ECB holds rates amid growth fears,business
1763,Deutsche Telekom sees mobile gain,business
1764,Optimism remains over UK housing,business
1765,Lloyd's of London head chides FSA,business
1766,Tsunami slows Sri Lanka's growth,business
1767,Worldcom boss 'left books alone',business
1768,China suspends 26 power projects,business
1769,India and Russia in energy talks,business
1770,Bargain calls widen Softbank loss,business
1771,Air China in $1bn London listing,business
1772,EU to probe Alitalia 'state aid',business
1773,Weak dollar trims Cadbury profits,business
1774,Dutch bank to lay off 2850 staff,business
1775,GM Ford cut output as sales fall,business
1776,Minister hits out at Yukos sale,business
1777,Aviation firms eye booming India,business
1778,Russian oil merger excludes Yukos,business
1779,AstraZeneca hit by drug failure,business
1780,UK young top Euro earnings league,business
1781,Making your office work for you,business
1782,Wembley firm won't make a profit,business
1783,BA to suspend two Saudi services,business
1784,Europe asks Asia for euro help,business
1785,Borussia Dortmund near bust,business
1786,Ebbers 'aware' of WorldCom fraud,business
1787,Japan economy slides to recession,business
1788,Crude oil prices back above $50,business
1789,IMF agrees fresh Turkey funding,business
1790,Economy 'strong' in election year,business
1791,US seeks new $280bn smoker ruling,business
1792,Executive trio leave Aer Lingus,business
1793,India's Deccan seals $1.8bn deal,business
1794,European losses hit GM's profits,business
1795,Yukos accused of lying to court,business
1796,Indonesians face fuel price rise,business
1797,French boss to leave EADS,business
1798,Card fraudsters 'targeting web',business
1799,Further rise in UK jobless total,business
1800,UK economy ends year with spurt,business
1801,FBI agent colludes with analyst,business
1802,SEC to rethink post-Enron rules,business
1803,Standard Life cuts policy bonuses,business
1804,China's Shanda buys stake in Sina,business
1805,Share boost for feud-hit Reliance,business
1806,Glazer makes new Man Utd approach,business
1807,Amex shares up on spin-off news,business
1808,Khodorkovsky ally denies charges,business
1809,Euronext 'poised to make LSE bid',business
1810,Tobacco giants hail court ruling,business
1811,US insurer Marsh cuts 2500 jobs,business
1812,Iraq and Afghanistan in WTO talks,business
1813,Irish duo could block Man Utd bid,business
1814,LSE 'sets date for takeover deal',business
1815,Battered dollar hits another low,business
1816,Oil prices reach three-month low,business
1817,Profits slide at India's Dr Reddy,business
1818,Brazil plays down Varig rescue,business
1819,Worldcom director ends evidence,business
1820,Unilever shake up as profit slips,business
1821,WorldCom director admits lying,business
1822,US firm pulls out of Iraq,business
1823,Warning over US pensions deficit,business
1824,Confusion over high-definition TV,tech
1825,Progress on new internet domains,tech
1826,Why Cell will get the hard sell,tech
1827,Beckham virus spotted on the net,tech
1828,'Ultimate game' award for Doom 3,tech
1829,Web helps collect aid donations,tech
1830,Games win for Blu-ray DVD format,tech
1831,Anti-spam screensaver scrapped,tech
1832,ITunes user sues Apple over iPod,tech
1833,Domain system opens door to scams,tech
1834,Court mulls file-sharing future,tech
1835,Iran jails blogger for 14 years,tech
1836,PC ownership to 'double by 2010',tech
1837,Lasers help bridge network gaps,tech
1838,Mobiles rack up 20 years of use,tech
1839,Robotic pods take on car design,tech
1840,Pompeii gets digital make-over,tech
1841,Smart search lets art fans browse,tech
1842,Virus poses as Christmas e-mail,tech
1843,Gadget show heralds MP3 Christmas,tech
1844,Broadband in the UK growing fast,tech
1845,Apple iPod family expands market,tech
1846,Bond game fails to shake or stir,tech
1847,Podcasts mark rise of DIY radio,tech
1848,Looks and music to drive mobiles,tech
1849,'Brainwave' cap controls computer,tech
1850,DVD copy protection strengthened,tech
1851,Solutions to net security fears,tech
1852,Mobile TV tipped as one to watch,tech
1853,The Force is strong in Battlefront,tech
1854,Movie body targets children's PCs,tech
1855,Napster offers rented music to go,tech
1856,Microsoft gets the blogging bug,tech
1857,Xbox power cable 'fire fear',tech
1858,Toxic web links help virus spread,tech
1859,US hacker breaks into T-Mobile,tech
1860,Mobile gig aims to rock 3G,tech
1861,Gangsters dominate gaming chart,tech
1862,2D Metal Slug offers retro fun,tech
1863,Losing yourself in online gaming,tech
1864,File-swappers ready new network,tech
1865,Local net TV takes off in Austria,tech
1866,Have hackers recruited your PC?,tech
1867,Search wars hit desktop PCs,tech
1868,Can Yahoo dominate next decade?,tech
1869,Half-Life 2 sweeps Bafta awards,tech
1870,Apple laptop is 'greatest gadget',tech
1871,Sony PSP tipped as a 'must-have',tech
1872,US top of supercomputing charts,tech
1873,Computer grid to help the world,tech
1874,UK pioneers digital film network,tech
1875,France starts digital terrestrial,tech
1876,Be careful how you code,tech
1877,Apple sues 'Tiger' file sharers,tech
1878,Broadband fuels online change,tech
1879,Fast lifts rise into record books,tech
1880,Microsoft seeking spyware trojan,tech
1881,No half measures with Half-Life 2,tech
1882,Peer-to-peer nets 'here to stay',tech
1883,Remote control rifle range debuts,tech
1884,Portable PlayStation ready to go,tech
1885,Nuclear body seeks new tech,tech
1886,What high-definition will do to DVDs,tech
1887,Global blogger action day called,tech
1888,Consumers 'snub portable video',tech
1889,Web radio takes Spanish rap global,tech
1890,Nintendo adds media playing to DS,tech
1891,Kenyan school turns to handhelds,tech
1892,US cyber security chief resigns,tech
1893,Concerns over Windows ATMs,tech
1894,Bush website blocked outside US,tech
1895,Text message record smashed again,tech
1896,'Ultimate game' award for Doom 3,tech
1897,Swap offer for pirated Windows XP,tech
1898,A decade of good website design,tech
1899,TV future in the hands of viewers,tech
1900,EA to take on film and TV giants,tech
1901,Junk e-mails on relentless rise,tech
1902,Dozens held over ID fraud site,tech
1903,Blind student 'hears in colour',tech
1904,How to make a greener computer,tech
1905,Media gadgets get moving,tech
1906,EU software patent law faces axe,tech
1907,Savvy searchers fail to spot ads,tech
1908,2D Metal Slug offers retro fun,tech
1909,Broadband in the UK growing fast,tech
1910,Players sought for $1m prize,tech
1911,Format wars could 'confuse users',tech
1912,Gizmondo gadget hits the shelves,tech
1913,'No re-draft' for EU patent law,tech
1914,Apple makes blogs reveal sources,tech
1915,Tech helps disabled speed demons,tech
1916,Blog reading explodes in America,tech
1917,Fast moving phone bugs appear,tech
1918,Microsoft sets sights on spyware,tech
1919,Digital guru floats sub-$100 PC,tech
1920,US peer-to-peer pirates convicted,tech
1921,Mobile gaming takes off in India,tech
1922,Peer-to-peer nets 'here to stay',tech
1923,BBC leads interactive Bafta wins,tech
1924,'Brainwave' cap controls computer,tech
1925,Mobile multimedia slow to catch on,tech
1926,China 'to overtake US net use',tech
1927,Broadband takes on TV viewing,tech
1928,Text message record smashed,tech
1929,Apple unveils low-cost 'Mac mini',tech
1930,DVD copy protection strengthened,tech
1931,Search sites get closer to users,tech
1932,Cabs collect mountain of mobiles,tech
1933,Mobile networks seek turbo boost,tech
1934,Warning over tsunami aid website,tech
1935,Game firm holds 'cast' auditions,tech
1936,Millions buy MP3 players in US,tech
1937,Sun offers processing by the hour,tech
1938,Microsoft launches its own search,tech
1939,Blogger grounded by her airline,tech
1940,Speak easy plan for media players,tech
1941,Ban hits Half-Life 2 pirates hard,tech
1942,Sun offers processing by the hour,tech
1943,California sets fines for spyware,tech
1944,Hotspot users gain free net calls,tech
1945,Piero gives rugby perspective,tech
1946,New consoles promise big problems,tech
1947,When invention turns to innovation,tech
1948,Ultra fast wi-fi nears completion,tech
1949,Robots learn 'robotiquette' rules,tech
1950,Ink helps drive democracy in Asia,tech
1951,Microsoft releases patches,tech
1952,Disney backs Sony DVD technology,tech
1953,Mobile audio enters new dimension,tech
1954,California sets fines for spyware,tech
1955,UK broadband gets speed injection,tech
1956,Spam e-mails tempt net shoppers,tech
1957,What price for 'trusted PC security'?,tech
1958,Cheaper chip for mobiles,tech
1959,Cebit opens to mobile music tune,tech
1960,Big war games battle it out,tech
1961,Millions to miss out on the net,tech
1962,Ask Jeeves joins web log market,tech
1963,Viewers to be able to shape TV,tech
1964,Lifestyle 'governs mobile choice',tech
1965,Savvy searchers fail to spot ads,tech
1966,Firefox browser takes on Microsoft,tech
1967,Telewest to challenge Sky Plus,tech
1968,Joke e-mail virus tricks users,tech
1969,Attack prompts Bush site block,tech
1970,Software watching while you work,tech
1971,Nintendo DS aims to touch gamers,tech
1972,Tough rules for ringtone sellers,tech
1973,When technology gets personal,tech
1974,Pandas benefit from wireless net,tech
1975,Microsoft plans 'safer ID' system,tech
1976,Go-ahead for new internet names,tech
1977,World tour for top video gamers,tech
1978,UK net users leading TV downloads,tech
1979,Apple laptop is 'greatest gadget',tech
1980,Millions to miss out on the net,tech
1981,Santy worm makes unwelcome visit,tech
1982,Broadband soars in 2004,tech
1983,Video phones act as dating tools,tech
1984,Spam e-mails tempt net shoppers,tech
1985,Security warning over 'FBI virus',tech
1986,Gadget growth fuels eco concerns,tech
1987,A question of trust and technology,tech
1988,Gritty return for Prince of Persia,tech
1989,China 'blocks Google news site',tech
1990,Mobiles rack up 20 years of use,tech
1991,Latest Opera browser gets vocal,tech
1992,Gadgets galore on show at fair,tech
1993,Software watching while you work,tech
1994,Doors open at biggest gadget fair,tech
1995,Hollywood campaign hits websites,tech
1996,Poles play with GameBoy 'blip-pop',tech
1997,Nintendo DS makes its Euro debut,tech
1998,Warnings on woeful wi-fi security,tech
1999,Google's toolbar sparks concern,tech
2000,More power to the people says HP,tech
2001,Digital UK driven by net and TV,tech
2002,Multi-purpose TV aids India,tech
2003,Half of UK's mobiles 'go online',tech
2004,Warning over Windows Word files,tech
2005,Intel unveils laser breakthrough,tech
2006,Rivals of the £400 Apple...,tech
2007,Mobile networks seek turbo boost,tech
2008,Cyber criminals step up the pace,tech
2009,Gadget market 'to grow in 2005',tech
2010,First look at PlayStation 3 chip,tech
2011,Broadband set to revolutionise TV,tech
2012,Home phones face unclear future,tech
2013,Games win for Blu-ray DVD format,tech
2014,Format wars could 'confuse users',tech
2015,Finding new homes for old phones,tech
2016,Mobile multimedia slow to catch on,tech
2017,EU software patent law faces axe,tech
2018,Warnings about junk mail deluge,tech
2019,Apple Mac mini gets warm welcome,tech
2020,Security scares spark browser fix,tech
2021,Halo 2 heralds traffic explosion,tech
2022,'Friends fear' with lost mobiles,tech
2023,Apple iPod family expands market,tech
2024,Disney backs Sony DVD technology,tech
2025,Mobiles 'not media players yet',tech
2026,Hi-tech posters guide commuters,tech
2027,Parents face video game lessons,tech
2028,Gadget show heralds MP3 season,tech
2029,US state acts to stop 'spammers',tech
2030,Anti-spam laws bite spammer hard,tech
2031,Hollywood to sue net film pirates,tech
2032,Sony PSP console hits US in March,tech
2033,Honour for UK games maker,tech
2034,Games firms 'face tough future',tech
2035,Britons fed up with net service,tech
2036,Argonaut founder rebuilds empire,tech
2037,Voters flock to blog awards site,tech
2038,The year search became personal,tech
2039,T-Mobile bets on 'pocket office',tech
2040,Microsoft takes on desktop search,tech
2041,Sony PSP console hits US in March,tech
2042,Anti-tremor mouse stops PC shakes,tech
2043,Games enter the classroom,tech
2044,How to smash a home computer,tech
2045,DS aims to touch gamers,tech
2046,Looks and music to drive mobiles,tech
2047,Gates opens biggest gadget fair,tech
2048,Gamers snap up new Sony PSP,tech
2049,US woman sues over cartridges,tech
2050,Souped-up wi-fi is on the horizon,tech
2051,Latest Opera browser gets vocal,tech
2052,Halo 2 sells five million copies,tech
2053,Microsoft debuts security tools,tech
2054,Rolling out next generation's net,tech
2055,Google launches TV search service,tech
2056,Domain system scam fear,tech
2057,Broadband steams ahead in the US,tech
2058,Kenyan school turns to handhelds,tech
2059,Chip maker backs net phone calls,tech
2060,Warning over tsunami aid website,tech
2061,British Library gets wireless net,tech
2062,Fast moving phone viruses appear,tech
2063,'Evil twin' fear for wireless net,tech
2064,Smartphones suffer Skulls attack,tech
2065,Creator of first Apple Mac dies,tech
2066,Millions buy MP3 players in US,tech
2067,T-Mobile bets on 'pocket office',tech
2068,Speech takes on search engines,tech
2069,US duo in first spam conviction,tech
2070,Halo fans' hope for sequel,tech
2071,Gamer buys $26500 virtual land,tech
2072,BT boosts its broadband packages,tech
2073,Web logs aid disaster recovery,tech
2074,Apple sues to stop product leaks,tech
2075,Freeze on anti-spam campaign,tech
2076,Microsoft releases bumper patches,tech
2077,Satellite mapping aids Darfur relief,tech
2078,Learning to love broadband,tech
2079,Britons growing 'digitally obese',tech
2080,Musicians 'upbeat' about the net,tech
2081,Mobile music challenges 'iPod age',tech
2082,Broadband in the UK gathers pace,tech
2083,Commodore finds new lease of life,tech
2084,The gaming world in 2005,tech
2085,BT program to beat dialler scams,tech
2086,Yahoo celebrates a decade online,tech
2087,Blinx sequel purrs nicely,tech
2088,Video phone help for deaf people,tech
2089,Mobiles 'not media players yet',tech
2090,More movies head to Sony's PSP,tech
2091,Dublin hi-tech labs to shut down,tech
2092,Sony PSP tipped as a 'must-have',tech
2093,Norway upholds 'Napster' ruling,tech
2094,GTA sequel is criminally good,tech
2095,Freeze on anti-spam campaign,tech
2096,Junk e-mails on relentless rise,tech
2097,The future in your pocket,tech
2098,Intel unveils laser breakthrough,tech
2099,Commodore finds new lease of life,tech
2100,US blogger fired by her airline,tech
2101,How to make a gigapixel picture,tech
2102,Text messages aid disaster recovery,tech
2103,New delay hits EU software laws,tech
2104,US duo in first spam conviction,tech
2105,Microsoft gets the blogging bug,tech
2106,Football Manager scores big time,tech
2107,Rings of steel combat net attacks,tech
2108,Cebit fever takes over Hanover,tech
2109,Napster offers rented music to go,tech
2110,Supercomputer breaks speed record,tech
2111,Open source leaders slam patents,tech
2112,Camera phones are 'must-haves',tech
2113,Reboot ordered for EU patent law,tech
2114,Online commons to spark debate,tech
2115,Blind student 'hears in colour',tech
2116,Progress on new internet domains,tech
2117,Apple attacked over sources row,tech
2118,'No re-draft' for EU patent law,tech
2119,Speak easy plan for media players,tech
2120,IBM frees 500 software patents,tech
2121,Mobiles get set for visual radio,tech
2122,Broadband fuels online expression,tech
2123,Screensaver tackles spam websites,tech
2124,Microsoft seeking spyware trojan,tech
2125,UK gets official virus alert site,tech
2126,Europe backs digital TV lifestyle,tech
2127,Moving mobile improves golf swing,tech
2128,Xbox 2 may be unveiled in summer,tech
2129,Technology gets the creative bug,tech
2130,BT offers free net phone calls,tech
2131,US woman sues over ink cartridges,tech
2132,Broadband challenges TV viewing,tech
2133,Sporting rivals go to extra time,tech
2134,Mac Mini heralds mini revolution,tech
2135,Rich pickings for hi-tech thieves,tech
2136,Game makers get Xbox 2 sneak peek,tech
2137,China 'ripe' for media explosion,tech
2138,PlayStation 3 chip to be unveiled,tech
2139,Hacker threat to Apple's iTunes,tech
2140,Wi-fi web reaches farmers in Peru,tech
2141,Bad e-mail habits sustains spam,tech
2142,Sony PSP handheld console hits US,tech
2143,IBM puts cash behind Linux push,tech
2144,Web photo storage market hots up,tech
2145,Who do you think you are?,tech
2146,EU software patent law delayed,tech
2147,Tough rules for ringtone sellers,tech
2148,Internet boom for gift shopping,tech
2149,'Blog' picked as word of the year,tech
2150,Lifestyle 'governs mobile choice',tech
2151,What high-definition will do to DVDs,tech
2152,Man auctions ad space on forehead,tech
2153,TV's future down the phone line,tech
2154,Global digital divide 'narrowing',tech
2155,Cyber crime booms in 2004,tech
2156,Long life promised for laptop PCs,tech
2157,Slimmer PlayStation triple sales,tech
2158,Mobile games come of age,tech
2159,The pirates with no profit motive,tech
2160,Nintendo handheld given Euro date,tech
2161,Call for action on internet scam,tech
2162,Web radio takes Spanish rap global,tech
2163,Gamers could drive high-definition,tech
2164,Digital guru floats sub-$100 PC,tech
2165,Virus poses as Christmas e-mail,tech
2166,Hitachi unveils 'fastest robot',tech
2167,China net cafe culture crackdown,tech
2168,Britons fed up with net service,tech
2169,Games help you 'learn and play',tech
2170,Musical future for phones,tech
2171,'Podcasters' look to net money,tech
2172,More power to the people says HP,tech
2173,US blogger fired by her airline,tech
2174,Windows worm travels with Tetris,tech
2175,Casual gaming to 'take off',tech
2176,Consumer concern over RFID tags,tech
2177,Movie body hits peer-to-peer nets,tech
2178,Microsoft debuts security tools,tech
2179,BBC web search aids odd queries,tech
2180,Net regulation 'still possible',tech
2181,Mobiles double up as bus tickets,tech
2182,Loyalty cards idea for TV addicts,tech
2183,Yahoo moves into desktop search,tech
2184,Putting a face to 'Big Brother',tech
2185,Apple unveils low-cost 'Mac mini',tech
2186,Blogs take on the mainstream,tech
2187,Slim PlayStation triples sales,tech
2188,Seamen sail into biometric future,tech
2189,What's next for next-gen consoles?,tech
2190,PC photo printers challenge pros,tech
2191,Ask Jeeves joins web log market,tech
2192,Gadget market 'to grow in 2005',tech
2193,Humanoid robot learns how to run,tech
2194,Apple attacked over sources row,tech
2195,New Year's texting breaks record,tech
2196,Set your television to wow,tech
2197,Games 'deserve a place in class',tech
2198,Hotspot users gain free net calls,tech
2199,Microsoft makes anti-piracy move,tech
2200,IBM puts cash behind Linux push,tech
2201,Microsoft makes anti-piracy move,tech
2202,Google to scan famous libraries,tech
2203,Concern over RFID tags,tech
2204,Europe backs digital TV lifestyle,tech
2205,Row brewing over peer-to-peer ads,tech
2206,Mobile picture power in your pocket,tech
2207,Slow start to speedy net services,tech
2208,File-swappers ready new network,tech
2209,Cable offers video-on-demand,tech
2210,Online games play with politics,tech
2211,More women turn to net security,tech
2212,Doors open at biggest gadget fair,tech
2213,Camera phones are 'must-haves',tech
2214,PlayStation 3 processor unveiled,tech
2215,Seamen sail into biometric future,tech
2216,Virgin Radio offers 3G broadcast,tech
2217,Rings of steel combat net attacks,tech
2218,Mobile games come of age,tech
2219,US peer-to-peer pirates convicted,tech
2220,New browser wins over net surfers,tech
2221,Sony wares win innovation award,tech
2222,Games maker fights for survival,tech
2223,Security warning over 'FBI virus',tech
2224,Net fingerprints combat attacks,tech
