542,Wales silent on Grand Slam talk,sport
543,Highbury tunnel players in clear,sport
544,Navratilova hits out at critics,sport
545,England coach faces rap after row,sport
546,Moya fights back for Indian title,sport
547,Parry puts Gerrard 'above money',sport
548,Mirza makes Indian tennis history,sport
549,Claxton hunting first major medal,sport
550,Roddick into San Jose final,sport
551,McIlroy wins 800m indoor title,sport
552,Hearts of Oak 3-2 Cotonsport,sport
553,Worcester v Sale (Fri),sport
554,Van Nistelrooy set to return,sport
555,Yeading face Newcastle in FA Cup,sport
556,Tigers wary of Farrell 'gamble',sport
557,Saint-Andre anger at absent stars,sport
558,Parmar ruled out of Davis Cup tie,sport
559,IAAF awaits Greek pair's response,sport
560,Moore questions captaincy,sport
561,Lewsey puzzle over disallowed try,sport
562,Edu blasts Arsenal,sport
563,Ireland win eclipses refereeing 'errors',sport
564,Minister digs in over doping row,sport
565,Williams says he will never quit,sport
566,Henman to face Saulnier test,sport
567,Wright-Phillips to start on right,sport
568,Murray to make Cup history,sport
569,Can Smith work Scottish wonders?,sport
570,Bath faced with Tindall ultimatum,sport
571,Bellamy under new fire,sport
572,Record fails to lift lacklustre meet,sport
573,Sociedad set to rescue Mladenovic,sport
574,England's defensive crisis grows,sport
575,Wada will appeal against ruling,sport
576,Candela completes Bolton switch,sport
577,Lewis-Francis eyeing world gold,sport
578,Coach Ranieri sacked by Valencia,sport
579,Dundee Utd 4-1 Aberdeen,sport
580,South Africa sweep top awards,sport
581,Beckham relief as Real go through,sport
582,Gerrard happy at Anfield,sport
583,Radcliffe yet to answer GB call,sport
584,Ireland call up uncapped Campbell,sport
585,Wolves appoint Hoddle as manager,sport
586,Williams battles to Aussie title,sport
587,Spain coach faces racism inquiry,sport
588,O'Leary agrees new Villa contract,sport
589,Campbell to be Lions consultant,sport
590,Moya emotional at Davis Cup win,sport
591,Wenger keeping faith with Almunia,sport
592,Jones medals 'must go if guilty',sport
593,Running around the Olympics,sport
594,Celtic make late bid for Bellamy,sport
595,Mourinho plots impressive course,sport
596,Stuart joins Norwich from Addicks,sport
597,Davenport hits out at Wimbledon,sport
598,Fuming Robinson blasts officials,sport
599,Safin plays down Wimbledon hopes,sport
600,Thanou desperate to make return,sport
601,Cudicini misses Carling Cup final,sport
602,Wilkinson to lead England,sport
603,Arsenal through on penalties,sport
604,Ferguson rues failure to cut gap,sport
605,Everton's Weir cools Euro hopes,sport
606,Teenager Tait picked for England,sport
607,England 'to launch ref protest',sport
608,Collins to compete in Birmingham,sport
609,Murray returns to Scotland fold,sport
610,Hodges announces rugby retirement,sport
611,Chelsea sack Mutu,sport
612,Gronkjaer agrees switch to Madrid,sport
613,Disappointed Scott in solid start,sport
614,Celts savour Grand Slam prospect,sport
615,Agassi fear for Melbourne,sport
616,London hope over Chepkemei,sport
617,Soderling wins tense Milan final,sport
618,O'Sullivan quick to hail Italians,sport
619,Bekele sets sights on world mark,sport
620,Kerr frustrated at victory margin,sport
621,Fear will help France - Laporte,sport
622,SA return to Mauritius,sport
623,Italy aim to rattle England,sport
624,Hearts 2-1 Livingston,sport
625,Benitez joy as Reds take control,sport
626,Connors boost for British tennis,sport
627,Vickery out of Six Nations,sport
628,Call for Kenteris to be cleared,sport
629,Serena ends Sania Mirza's dream,sport
630,Dallaglio eyeing Lions tour place,sport
631,McIlroy aiming for Madrid title,sport
632,Collins appeals against drugs ban,sport
633,Bell set for England debut,sport
634,Edwards tips Idowu for Euro gold,sport
635,Prodigy Monfils blows away Gaudio,sport
636,Lennon brands Rangers favourites,sport
637,Holmes back on form in Birmingham,sport
638,Radcliffe tackles marathon tasks,sport
639,Bristol City 2-1 Milton Keynes,sport
640,Scotland v Italy (Sat),sport
641,Hitzlsperger waiting on O'Leary,sport
642,Mourinho to escape FA charge,sport
643,Kewell waits as injury drags on,sport
644,Blues slam Blackburn over Savage,sport
645,Dawson set for new Wasps contract,sport
646,Hamm bows out for US,sport
647,El Guerrouj targets cross country,sport
648,Mido makes third apology,sport
649,Greek duo cleared in doping case,sport
650,Hewitt fights back to reach final,sport
651,Rochus shocks Coria in Auckland,sport
652,Chepkemei hit by big ban,sport
653,Johansson takes Adelaide victory,sport
654,Time to get tough on friendlies?,sport
655,Safin cool on Wimbledon,sport
656,Jones files lawsuit against Conte,sport
657,Robertson out to retain Euro lure,sport
658,Wasps 31-37 Leicester,sport
659,English clubs make Euro history,sport
660,Munster Cup tie switched to Spain,sport
661,Ferrero eyes return to top form,sport
662,Scots suffer another injury blow,sport
663,Tomlinson stays focused on Europe,sport
664,Arnesen denies rift with Santini,sport
665,Rush future at Chester uncertain,sport
666,Moody joins up with England,sport
667,O'Driscoll out of Scotland game,sport
668,Irish finish with home game,sport
669,Roddick in talks over new coach,sport
670,Ferguson puts faith in youngsters,sport
671,Johnson accuses British sprinters,sport
672,Beckham rules out management move,sport
673,Hantuchova in Dubai last eight,sport
674,Wales make two changes for France,sport
675,Hodgson relishes European clashes,sport
676,Wales coach elated with win,sport
677,Lomu relishing return to action,sport
678,African double in Edinburgh,sport
679,Jones files Conte lawsuit,sport
680,Spurs to sign Iceland U21 star,sport
681,Britain boosted by Holmes double,sport
682,Dal Maso in to replace Bergamasco,sport
683,Barkley fit for match in Ireland,sport
684,Uefa approves fake grass,sport
685,O'Gara revels in Ireland victory,sport
686,Johnson uncertain about Euro bid,sport
687,FA probes crowd trouble,sport
688,GB select Holmes for double bid,sport
689,Sella wants Michalak recall,sport
690,Gatlin and Hayes win Owen awards,sport
691,McClaren eyes Uefa Cup top spot,sport
692,Keegan hails comeback king Fowler,sport
693,Chelsea denied by James heroics,sport
694,Solskjaer raises hopes of return,sport
695,Ivanovic seals Canberra victory,sport
696,Gardener battles to narrow win,sport
697,Middlesbrough 2-2 Charlton,sport
698,Officials respond in court row,sport
699,Poll explains free-kick decision,sport
700,Almagro continues Spanish surge,sport
701,Mourinho defiant on Chelsea form,sport
702,Kuznetsova 'failed a drugs test',sport
703,O'Sullivan commits to Dublin race,sport
704,Benitez delight after crucial win,sport
705,Edgy Agassi struggles past Dent,sport
706,Cup holders Man Utd visit Everton,sport
707,Curbishley delight for Johansson,sport
708,Davenport puts retirement on hold,sport
709,Downing injury mars Uefa victory,sport
710,Dawson wins England squad recall,sport
711,Anelka apologises for criticism,sport
712,Hong Kong in 2011 World Cup bid,sport
713,Pearce keen on succeeding Keegan,sport
714,Sculthorpe wants Lions captaincy,sport
715,Radcliffe will compete in London,sport
716,Benitez 'to launch Morientes bid',sport
717,Bates seals takeover,sport
718,European medal chances improve,sport
719,Wilkinson return 'unlikely',sport
720,Ferguson hails Man Utd's resolve,sport
721,Charvis set to lose fitness bid,sport
722,Collins calls for Chambers return,sport
723,Israeli club look to Africa,sport
724,SFA awaits report over Mikoliunas,sport
725,Slovakia seal Hopman Cup success,sport
726,O'Driscoll saves Irish blushes,sport
727,Fuming Robinson blasts officials,sport
728,Costin aims for comeback in 2006,sport
729,Umaga ready for "fearsome" Lions,sport
730,Smith aims to bring back respect,sport
731,Hewitt falls to Dent,sport
732,Finnan says Irish can win group,sport
733,Wenger offers Mutu hope,sport
734,Owen determined to stay in Madrid,sport
735,Greek sprinters 'won't run again',sport
736,Republic to face China and Italy,sport
737,Dementieva prevails in Hong Kong,sport
738,Mauresmo opens with victory in LA,sport
739,Cole faces lengthy injury lay-off,sport
740,Souness delight at Euro progress,sport
741,Robinson ready for difficult task,sport
742,Paris promise raises Welsh hopes,sport
743,McLeish ready for criticism,sport
744,Tindall aiming to earn Lions spot,sport
745,Melzer shocks Agassi,sport
746,QPR keeper Day heads for Preston,sport
747,Isinbayeva heads for Birmingham,sport
748,Wilkinson fit to face Edinburgh,sport
749,2004: An Irish Athletics Year,sport
750,Tottenham bid &#163;8m for Forest duo,sport
751,Preview: Ireland v England (Sun),sport
752,Parry relishes Anfield challenge,sport
753,Leeds v Saracens (Fri),sport
754,Robinson out of Six Nations,sport
755,Newcastle line up Babayaro,sport
756,Campbell rescues Arsenal,sport
757,Hewitt falls to Dent in Adelaide,sport
758,Kirwan demands Italy consistency,sport
759,Scrum-half Williams rejoins Bath,sport
760,Italy 8-38 Wales,sport
761,Serena becomes world number two,sport
762,Rovers reject third Ferguson bid,sport
763,Hingis to make unexpected return,sport
764,Veteran Martinez wins Thai title,sport
765,Jones doping probe begins,sport
766,Roddick to face Saulnier in final,sport
767,Federer breezes into semi-finals,sport
768,Athens memories soar above lows,sport
769,Robben plays down European return,sport
770,Thanou bullish over drugs hearing,sport
771,Holmes starts 2005 with GB events,sport
772,Federer claims Dubai crown,sport
773,Dibaba breaks 5000m world record,sport
774,Iranian misses Israel match,sport
775,Melzer shocks Agassi in San Jose,sport
776,Mirza shocks Kuznetsova,sport
777,Faultless Federer has no equal,sport
778,Parker misses England clash,sport
779,Stam spices up Man Utd encounter,sport
780,Dogged Federer claims Dubai crown,sport
781,Kluft impressed by Sotherton form,sport
782,Corry backs skipper Robinson,sport
783,Yelling takes Cardiff hat-trick,sport
784,Owen set for skipper role,sport
785,Borders 19-20 Ulster,sport
786,Merritt close to indoor 400m mark,sport
787,Hodgson shoulders England blame,sport
788,Isinbayeva claims new world best,sport
789,Funding cut hits Wales Students,sport
790,Calder fears for Scottish rugby,sport
791,D'Arcy injury adds to Ireland woe,sport
792,O'Driscoll/Gregan lead Aid stars,sport
793,Robben and Cole earn Chelsea win,sport
794,Ajax refuse to rule out Jol move,sport
795,Spain coach faces racism inquiry,sport
796,Hewitt overcomes wobble in Sydney,sport
797,Nadal marches on in Mexico,sport
798,Barbarians 19-47 New Zealand,sport
799,Wenger steps up row,sport
800,Owen delighted with Real display,sport
801,Hereford 1-1 Doncaster,sport
802,Lewis-Francis turns to Christie,sport
803,Hewitt survives Nalbandian epic,sport
804,Bortolami predicts dour contest,sport
805,Gallas sees two-horse race,sport
806,Tindall wants second opinion,sport
807,Koubek suspended after drugs test,sport
808,Greek sprinters suspended by IAAF,sport
809,Wenger shock at Newcastle dip,sport
810,Rusedski forced out in Marseille,sport
811,Johnson announces June retirement,sport
812,Cole refuses to blame van Persie,sport
813,Ireland surge past Scots,sport
814,O'Sullivan keeps his powder dry,sport
815,Holmes starts 2005 with GB events,sport
816,O'Connor aims to grab opportunity,sport
817,Campbell lifts lid on United feud,sport
818,Relay squad thrilled with honours,sport
819,Fit-again Betsen in France squad,sport
820,IAAF launches fight against drugs,sport
821,Davenport dismantles young rival,sport
822,Henman decides to quit Davis Cup,sport
823,Ferguson rues failure to cut gap,sport
824,Dawson joins England injury list,sport
825,O'Sullivan could run in Worlds,sport
826,Umaga ready for Lions,sport
827,TV calls after Carroll error,sport
828,Edu describes tunnel fracas,sport
829,A year to remember for Irish,sport
830,Houllier praises Benitez regime,sport
831,Brentford v Southampton,sport
832,Newcastle to join Morientes race,sport
833,Aragones angered by racism fine,sport
834,Woodward eyes Brennan for Lions,sport
835,Hantuchova in Dubai last eight,sport
836,Radcliffe proves doubters wrong,sport
837,Thompson says Gerrard should stay,sport
838,Wolves appoint Hoddle as manager,sport
839,Capriati out of Australian Open,sport
840,GB quartet get cross country call,sport
841,Bryan twins keep US hopes alive,sport
842,Desailly backs Blues revenge trip,sport
843,Ferdinand casts doubt over Glazer,sport
844,Reds sink 10-man Magpies,sport
845,Classy Henman makes winning start,sport
846,Wenger handed summer war chest,sport
847,Davies favours Gloucester future,sport
848,Smith keen on Home series return,sport
849,Young debut cut short by Ginepri,sport
850,Weir poised for Sunderland move,sport
851,Newry to fight cup exit in courts,sport
852,Murphy: That was a bruising battle,sport
853,Sydney return for Henin-Hardenne,sport
854,Liverpool pledge to keep Gerrard,sport
855,Brizzel to run AAA's in Sheffield,sport
856,Davenport hits out at Wimbledon,sport
857,Philippoussis doubt over Open bid,sport
858,Real in talks over Gravesen move,sport
859,Chelsea hold Arsenal,sport
860,White admits to Balco drugs link,sport
861,Ferguson fears Milan cutting edge,sport
862,Moya emotional after Davis Cup win,sport
863,Man Utd through after Exeter test,sport
864,Chelsea clinch cup in extra-time,sport
865,Angry Williams rejects criticism,sport
866,Captains lining up for Aid match,sport
867,Capriati to miss Melbourne,sport
868,Johnson too strong for GB runners,sport
869,Edwards tips Idowu for Euro gold,sport
870,Henson stakes early Lions claim,sport
871,Liverpool revel in night of glory,sport
872,Johnson edges out rival Sotherton,sport
873,Big guns ease through in San Jose,sport
874,Slovakia reach Hopman Cup final,sport
875,Zambia confident and cautious,sport
876,Anelka 'eyes Man City departure',sport
877,Souness backs Smith for Scotland,sport
878,Wood - Ireland can win Grand Slam,sport
879,Newcastle 27-27 Gloucester,sport
880,Mourinho takes swipe at Arsenal,sport
881,Wenger dejected as Arsenal slump,sport
882,Wales stars need a rest - Ruddock,sport
883,Thomas out of Six Nations,sport
884,Duff ruled out of Barcelona clash,sport
885,France v Wales (Sat),sport
886,Blackburn v Burnley,sport
887,Henman overcomes rival Rusedski,sport
888,Harinordoquy suffers France axe,sport
889,Strachan turns down Pompey,sport
890,Man Utd stroll to Cup win,sport
891,Jones happy with Henson heroics,sport
892,Wenger signs new deal,sport
893,Bridge could miss rest of season,sport
894,Robben sidelined with broken foot,sport
895,Stevens named in England line-up,sport
896,A November to remember,sport
897,Will the Budget bring out smiling voters?,politics
898,Pre-poll clash on tax and spend,politics
899,MPs tout Lords replacement plan,politics
900,UK pledges £1bn to vaccine effort,politics
901,Tories pledge free sports lessons,politics
902,UK plan to deport terror suspects,politics
903,Civil servants in strike ballot,politics
904,Custody death rate 'shocks' MPs,politics
905,Labour trio 'had vote-rig factory',politics
906,Lib Dems unveil women's manifesto,politics
907,UK 'discriminated against Roma',politics
908,Leaders meet over Turkish EU bid,politics
909,Whitehall shredding increasing - Tories,politics
910,E-University 'disgraceful waste',politics
911,Ministers deny care sums 'wrong',politics
912,Iraqis win death test case probe,politics
913,New drink limit 'would cut toll',politics
914,UK's 'useless' quangos under fire,politics
915,Sainsbury's Labour election gift,politics
916,Women MPs reveal sexist taunts,politics
917,Faith schools citizenship warning,politics
918,UK troops on Ivory Coast standby,politics
919,Milburn defends poster campaign,politics
920,Army chiefs in regiments decision,politics
921,Howard's unfinished business,politics
922,UK heading wrong way - Howard,politics
923,Blair hails Turkey-EU talks deal,politics
924,Blunkett tells of love and pain,politics
925,Prime minister's questions,politics
926,Blunkett sorry over murder plan,politics
927,Blair defends terror law changes,politics
928,UKIP candidate suspended,politics
929,Vouchers 'to cut winter deaths',politics
930,Labour MP praises Tory campaign,politics
931,'Debate needed' on donations cap,politics
932,Blair returns from peace mission,politics
933,Sayeed to stand down as Tory MP,politics
934,Talks held on Gibraltar's future,politics
935,Thousands join strike in Wales,politics
936,Tory leader unveils spending plan,politics
937,Anti-terror plan faces first test,politics
938,New foot and mouth action urged,politics
939,'No-one can define new hunt ban',politics
940,Blair prepares to name poll date,politics
941,Visa row mandarin made Sir John,politics
942,Whitehall cuts 'ahead of target',politics
943,Cabinet anger at Brown cash raid,politics
944,Brown's poll campaign move denied,politics
945,'Super union' merger plan touted,politics
946,Campaign 'cold calls' questioned,politics
947,England children's tsar appointed,politics
948,Campbell: E-mail row 'silly fuss',politics
949,Tory leader 'cleared' over work,politics
950,Howard denies split over ID cards,politics
951,Mallon wades into NE vote battle,politics
952,Howard rebuts asylum criticisms,politics
953,Howard pitches for UK ethnic vote,politics
954,Tories reject rethink on axed MP,politics
955,'Poll Idols' face first hurdles,politics
956,Galloway plea for hostage release,politics
957,Blair dismisses quit claim report,politics
958,Hewitt decries 'career sexism',politics
959,Mayor will not retract Nazi jibe,politics
960,'EU referendum could cost £80m',politics
961,Tories opposing 24-hour drinking,politics
962,Blair 'damaged' by Blunkett row,politics
963,Muslim police stops 'more likely',politics
964,Parties warned over 'grey vote',politics
965,Boateng to step down at election,politics
966,Crisis 'ahead in social sciences',politics
967,Former NI minister Scott dies,politics
968,Stalemate in pension strike talks,politics
969,Kennedy to make temple address,politics
970,Hunt ban support is 'in decline',politics
971,Ex-PM Lord Callaghan dies aged 92,politics
972,Tories plan migrant health checks,politics
973,Council tax rise 'reasonable',politics
974,Observers to monitor UK election,politics
975,End Bush 'denial' Blair tells EU,politics
976,Cherie accused of attacking Bush,politics
977,MPs' murder sentence concern,politics
978,Ministers 'naive' over phone-taps,politics
979,Donor attacks Blair-Brown 'feud',politics
980,Kelly trails new discipline power,politics
981,Tory leader urges Harry apology,politics
982,MPs criticise child access system,politics
983,Conservative MP defects to Labour,politics
984,Voters 'reject EU by two to one',politics
985,Manchester wins Labour conference,politics
986,Tory backing for ID cards,politics
987,'Few ready' for information act,politics
988,Chancellor rallies Labour voters,politics
989,UK helps raped Rwandan women,politics
990,UKIP outspent Labour on EU poll,politics
991,'Last chance' warning for voters,politics
992,Brown ally rejects Budget spree,politics
993,Anglers 'could face prosecution',politics
994,Lib Dems stress Budget trust gap,politics
995,Howard and Blair tax pledge clash,politics
996,Asylum children to face returns,politics
997,CSA 'could close' says minister,politics
998,What the election should really be about?,politics
999,Drive to 'save' festive holidays,politics
1000,Boris opposes mayor apology,politics
1001,Guantanamo four free in weeks,politics
1002,UKIP candidate suspended in probe,politics
1003,Blair and Blunkett Sheffield trip,politics
1004,Police urge pub closure power,politics
1005,Blunkett unveils policing plans,politics
1006,Tories urge 'change at the top',politics
1007,BNP leader Nick Griffin arrested,politics
1008,'Nuclear dumpsite' plan attacked,politics
1009,Boothroyd calls for Lords speaker,politics
1010,Blair 'up for it' ahead of poll,politics
1011,Labour seeks to quell feud talk,politics
1012,Parties warned over 'grey vote',politics
1013,Lib Dems target the student vote,politics
1014,Brown targets OAPs and homebuyers,politics
1015,Kennedy begins pre-election tour,politics
1016,Butler launches attack on Blair,politics
1017,Brown visits slum on Africa trip,politics
1018,Student 'fee factor' played down,politics
1019,Minimum wage increased to £5.05,politics
1020,Russian ex-spy on hunger strike,politics
1021,Blunkett row should end - Blair,politics
1022,Galloway targets 'New Labour' MP,politics
1023,Tsunami 'won't divert Africa aid',politics
1024,Nat Insurance to rise say Tories,politics
1025,US casino 'tricks' face ban in UK,politics
1026,Abortion not a poll issue - Blair,politics
1027,Strike threat over pension plans,politics
1028,Lib Dems demand new inquiry,politics
1029,Labour faces 'cold calls' inquiry,politics
1030,Defiant hunts put ban to the test,politics
1031,Labour's Cunningham to stand down,politics
1032,NHS waiting time target is cut,politics
1033,Labour plans maternity pay rise,politics
1034,Cardinal criticises Iraq war cost,politics
1035,Jamieson issues warning to bigots,politics
1036,UKIP could sue Veritas defectors,politics
1037,Tories 'would cut number of MPs',politics
1038,Tutu's Guantanamo release call,politics
1039,Lib Dems predict 'best ever poll',politics
1040,'UK will stand firm on EU rebate',politics
1041,Scots smoking ban details set out,politics
1042,Tories outlining policing plans,politics
1043,New UKIP defection to 'Veritas',politics
1044,Top judge clashes with ministers,politics
1045,Tory candidate quits over remark,politics
1046,Labour in constituency race row,politics
1047,MP's shock at long lost daughter,politics
1048,Tory expert denies defeatism,politics
1049,Parliament's record of scandal,politics
1050,EU fraud clampdown urged,politics
1051,Opposition grows to house arrests,politics
1052,Boothroyd calls for Lords speaker,politics
1053,MPs issued with Blackberry threat,politics
1054,'Fido' to be taken off vote lists,politics
1055,Police probe BNP mosque leaflet,politics
1056,Child access laws shake-up,politics
1057,Turkey deal 'to help world peace',politics
1058,Brown outlines third term vision,politics
1059,BAA support ahead of court battle,politics
1060,Row over 'police' power for CSOs,politics
1061,The memory driving Brown's mission,politics
1062,Mrs Howard gets key election role,politics
1063,Election 'could be terror target',politics
1064,Tories unveil quango blitz plans,politics
1065,Blair and Brown criticised by MPs,politics
1066,Blair looks to election campaign,politics
1067,Straw backs ending China embargo,politics
1068,Clarke faces ID cards rebellion,politics
1069,'Hitler' row over Welsh arts cash,politics
1070,'No more concessions' on terror,politics
1071,Jowell confirms casino climbdown,politics
1072,Blair dismisses quit claim report,politics
1073,Blair says mayor should apologise,politics
1074,Baron Kinnock makes Lords debut,politics
1075,Tory leader quits legal position,politics
1076,Escaped prisoner report ordered,politics
1077,UK rebate 'unjustified' - Chirac,politics
1078,Kinnock to urge reform in Lords,politics
1079,Brown in appeal for Labour unity,politics
1080,Blair pledges unity to Labour MPs,politics
1081,Fox attacks Blair's Tory 'lies',politics
1082,Labour's four little words,politics
1083,Crucial decision on super-casinos,politics
1084,Blair Labour's longest-serving PM,politics
1085,Budget to set scene for election,politics
1086,Game warnings 'must be clearer',politics
1087,Tories unveil quango blitz plans,politics
1088,Howard backs stem cell research,politics
1089,Voters 'don't trust politicians',politics
1090,Drink remark 'acts as diversion',politics
1091,Taxes must be trusted - Kennedy,politics
1092,Hunt demo at Labour meeting,politics
1093,Schools to take part in mock poll,politics
1094,Tories leave door open for Archer,politics
1095,Howard 'truanted to play snooker',politics
1096,Chancellor rallies Labour voters,politics
1097,UK firms 'embracing e-commerce',politics
1098,Pakistani women 'must not hide',politics
1099,Hague 'given up' his PM ambition,politics
1100,Tsunami debt deal to be announced,politics
1101,EU rules 'won't stop UK spending',politics
1102,Blair rejects Tory terror offer,politics
1103,Blair sets date for Africa report,politics
1104,Howard denies split over ID cards,politics
1105,Concerns at school diploma plan,politics
1106,Clarke defends terror detentions,politics
1107,Talks aim to avert pension strike,politics
1108,Lords wrong on detainees - Straw,politics
1109,Terror detainees win Lords appeal,politics
1110,Parties build up poll war chests,politics
1111,Burglar defence guidelines issued,politics
1112,Woolf murder sentence rethink,politics
1113,Brown to outline presidency goals,politics
1114,'Best person' for top legal job,politics
1115,Child access law shake-up planned,politics
1116,Councils prepare to set tax rises,politics
1117,UK 'needs true immigration data',politics
1118,Guantanamo man 'suing government',politics
1119,Labour's 'EU propaganda',politics
1120,Blair backs 'pre-election budget',politics
1121,Lord Scarman 93 dies peacefully,politics
1122,Campaign 'cold calls' questioned,politics
1123,UKIP's secret weapon?,politics
1124,MPs demand 'Budget leak' answers,politics
1125,Kilroy unveils immigration policy,politics
1126,Parties' plans for council tax,politics
1127,Analysis: No pain no gain?,politics
1128,Visa decision 'every 11 minutes',politics
1129,February poll claim 'speculation',politics
1130,Clarke to unveil immigration plan,politics
1131,Lib Dems highlight problem debt,politics
1132,Ban on hunting comes into force,politics
1133,Regiments' group in poll move,politics
1134,Profile: David Miliband,politics
1135,Howard dismisses Tory tax fears,politics
1136,MPs issued with Blackberry threat,politics
1137,Lawyer attacks anti-terror laws,politics
1138,UKIP MEP attacked German 'empire',politics
1139,Brown calls for £5.5bn Aids fund,politics
1140,Report attacks defence spending,politics
1141,Clarke to press on with ID cards,politics
