1142,Howard taunts Blair over splits,politics
1143,Commons hunt protest charges,politics
1144,Brown 'proud of economy record',politics
1145,CSA chief who 'quit' still in job,politics
1146,Correction agency plans dropped,politics
1147,Terror powers expose 'tyranny',politics
1148,No to Royal succession shake-up,politics
1149,Blair 'pressing US on climate',politics
1150,MPs to debate 'euthanasia laws',politics
1151,Goldsmith denies war advice claim,politics
1152,Profile: David Blunkett,politics
1153,Labour's election love-in,politics
1154,Councils 'must find Gypsy sites',politics
1155,Straw praises Kashmir moves,politics
1156,No election TV debate says Blair,politics
1157,EU China arms ban 'to be lifted',politics
1158,Howard attacks cost of asylum,politics
1159,David Blunkett in quotes,politics
1160,Howard unveils election platform,politics
1161,Fox attacks Blair's Tory 'lies',politics
1162,Kennedy questions trust of Blair,politics
1163,Blair rejects Iraq advice calls,politics
1164,Clarke plans migrant point scheme,politics
1165,Candidate resigns over BNP link,politics
1166,Labour accused of 'EU propaganda',politics
1167,Could rivalry overshadow election?,politics
1168,UK needs tax cuts Tories insist,politics
1169,Research fears over Kelly's views,politics
1170,Blunkett hints at election call,politics
1171,Guantanamo pair's passport ban,politics
1172,Peers debate Crown succession law,politics
1173,Brown and Blair face new rift claims,politics
1174,'Debate needed' on donations cap,politics
1175,Teenagers to be allowed to be MPs,politics
1176,Blair blasts Tory spending plans,politics
1177,Kennedy questions trust of Blair,politics
1178,New 'yob' targets to be unveiled,politics
1179,Blair says UK tsunami aid to soar,politics
1180,Labour accused of broken pledge,politics
1181,Blair to face trust issue head on,politics
1182,Profile: Gordon Brown,politics
1183,Kennedy calls for Iraq exit plans,politics
1184,Tory expert denies defeat warning,politics
1185,Brown shrugs off economy fears,politics
1186,Jowell rejects 'Las Vegas' jibe,politics
1187,Howard rejects BNP's claim,politics
1188,EU referendum question unveiled,politics
1189,'More to do' on adult literacy,politics
1190,Retirement age could be scrapped,politics
1191,Protect whistleblowers TUC says,politics
1192,MP attacked by muggers in Kenya,politics
1193,Conservative backing for ID cards,politics
1194,Blair ready to call election,politics
1195,How political squabbles snowball,politics
1196,Ministers lose slopping out case,politics
1197,UK set to cut back on embassies,politics
1198,Plan to give elderly care control,politics
1199,Labour targets 'hardcore truants',politics
1200,Short attacks US over tsunami aid,politics
1201,Kennedy predicts bigger turnout,politics
1202,Bid to cut court witness stress,politics
1203,Iraq advice claim sparks new row,politics
1204,Brown outlines third term vision,politics
1205,Amnesty chief laments war failure,politics
1206,More reforms ahead says Milburn,politics
1207,Labour battle plan 'hides Blair',politics
1208,'No UK apology' for colonial past,politics
1209,Top Tories on Lib Dem 'hit list',politics
1210,Blair congratulates Bush on win,politics
1211,Choose hope over fear - Kennedy,politics
1212,Tories attack burglar 'U-turns',politics
1213,Housing plans criticised by MPs,politics
1214,Lib Dems 'to target stamp duty',politics
1215,Nuclear strike 'key terror risk',politics
1216,Brown ally rejects Budget spree,politics
1217,Straw attacked on China arms,politics
1218,Kilroy names election seat target,politics
1219,Petrol duties frozen Brown says,politics
1220,Citizenship event for 18s touted,politics
1221,Labour's core support takes stock,politics
1222,Brown names 16 March for Budget,politics
1223,TV debate urged for party chiefs,politics
1224,Terror suspects face house arrest,politics
1225,Straw to attend Auschwitz service,politics
1226,Kennedy's cautious optimism,politics
1227,'Errors' doomed first Dome sale,politics
1228,Brown comes out shooting,politics
1229,Kennedy criticises 'unfair' taxes,politics
1230,Lib Dems unveil election slogan,politics
1231,Labour attacked on Howard poster,politics
1232,What really divides the parties,politics
1233,McConnell details Scots wave toll,politics
1234,Labour MPs' fears over squabbling,politics
1235,At a glance: Tory health checks,politics
1236,Lib Dems' new election PR chief,politics
1237,Guantanamo four questioned,politics
1238,Blair to face MPs amid feud talk,politics
1239,McConnell in 'drunk' remark row,politics
1240,Howard hits back at mongrel jibe,politics
1241,Abbas 'will not tolerate' attacks,politics
1242,Economy focus for election battle,politics
1243,Protesters plan airport challenge,politics
1244,Kilroy-Silk quits 'shameful' UKIP,politics
1245,UK heading wrong way says Howard,politics
1246,Hatfield executives go on trial,politics
1247,Talks aim to avert pension strike,politics
1248,Brown names 16 March for Budget,politics
1249,Job cuts 'false economy'  - TUC,politics
1250,Security papers 'found in street',politics
1251,MSPs hear renewed climate warning,politics
1252,Campbell returns to election team,politics
1253,Labour chooses Manchester,politics
1254,Blair 'said he would stand down',politics
1255,Blair backs 'pre-election budget',politics
1256,Watchdog probes e-mail deletions,politics
1257,Goldsmith: 'I was not leant on',politics
1258,Lib Dems' 'bold' election policy,politics
1259,Police chief backs drinking move,politics
1260,Howard attacks 'pay later' Budget,politics
1261,Labour pig poster 'anti-Semitic',politics
1262,Falconer rebuts 'charade' claims,politics
1263,Kennedy looks to election gains,politics
1264,Hospital suspends 'no Welsh' plan,politics
1265,Schools to take part in mock poll,politics
1266,Borders rail link campaign rally,politics
1267,Plaid MP's cottage arson claim,politics
1268,Probe launched on Ken Nazi jibe,politics
1269,Howard unveils Tory asylum plans,politics
1270,School sport 'is back' says PM,politics
1271,Wales 'must learn health lessons',politics
1272,Teens 'know little' of politics,politics
1273,Malik rejects all-black MP lists,politics
1274,Mandelson warns BBC on Campbell,politics
1275,Blair stresses prosperity goals,politics
1276,Blair told to double overseas aid,politics
1277,Peace demo appeal rejected,politics
1278,UK youth 'interested' in politics,politics
1279,MPs assess Scots fishing industry,politics
1280,Muslims discuss election concerns,politics
1281,Tories attack EU asylum moves,politics
1282,Student 'inequality' exposed,politics
1283,MPs quiz aides over royal income,politics
1284,Minister defends hunting ban law,politics
1285,Sport betting rules in spotlight,politics
1286,Royal couple watch nation's mood,politics
1287,Lib Dems target first-time buyers,politics
1288,Hague 'given up' his PM ambition,politics
1289,PM apology over jailings,politics
1290,Tory 'stalking horse' Meyer dies,politics
1291,Jack Cunningham to stand down,politics
1292,Assembly ballot papers 'missing',politics
1293,New rules tackle 'sham weddings',politics
1294,Blair's hope for Blunkett return,politics
1295,Gurkhas to help tsunami victims,politics
1296,Blair joins school sailing trip,politics
1297,Kilroy launches 'Veritas' party,politics
1298,Blair sees greater Bush consensus,politics
1299,Kilroy-Silk attacked with slurry,politics
1300,Blair moves to woo Jewish voters,politics
1301,'Super union' merger plan touted,politics
1302,Minimum rate for foster parents,politics
1303,Hague's six-figure earnings shown,politics
1304,Final hunts held as ban looms,politics
1305,Will Tory tax cuts lift spirits?,politics
1306,Defection timed to hit tax pledge,politics
1307,Brown hits back in Blair rift row,politics
1308,Election deal faltered over Heath role,politics
1309,Mandelson warning to BBC,politics
1310,Kilroy launches 'Veritas' party,politics
1311,Green fear for transport ballot,politics
1312,Immigration to be election issue,politics
1313,Act on detention ruling UK urged,politics
1314,Record year for Chilean copper,business
1315,Germany nears 1990 jobless level,business
1316,Euronext joins bid battle for LSE,business
1317,Tate & Lyle boss bags top award,business
1318,Deutsche Boerse boosts dividend,business
1319,High fuel costs hit US airlines,business
1320,India's Maruti sees profits jump,business
1321,'Strong dollar' call halts slide,business
1322,Wall Street cheers Bush victory,business
1323,Economy 'strong' in election year,business
1324,Alfa Romeos 'to get GM engines',business
1325,JP Morgan admits US slavery links,business
1326,Venezuela and China sign oil deal,business
1327,US manufacturing expands,business
1328,Egypt and Israel seal trade deal,business
1329,Ad firm WPP's profits surge 15%,business
1330,Q&A: Malcolm Glazer and Man Utd,business
1331,Mixed signals from French economy,business
1332,IMF 'cuts' German growth estimate,business
1333,Shares rise on new Man Utd offer,business
1334,WorldCom trial starts in New York,business
1335,Glaxo aims high after profit fall,business
1336,Home loan approvals rising again,business
1337,EC calls truce in deficit battle,business
1338,China Aviation seeks rescue deal,business
1339,India calls for fair trade rules,business
1340,Newest EU members underpin growth,business
1341,Christmas sales worst since 1981,business
1342,Germany calls for EU reform,business
1343,Iraq to invite phone licence bids,business
1344,Putin backs state grab for Yukos,business
1345,The 'ticking budget' facing the US,business
1346,Tsunami cost hits Jakarta shares,business
1347,Japanese growth grinds to a halt,business
1348,Lufthansa may sue over Bush visit,business
1349,Crossrail link 'to get go-ahead',business
1350,Senior Fannie Mae bosses resign,business
1351,Irish markets reach all-time high,business
1352,Ukraine strikes Turkmen gas deal,business
1353,WMC profits up amid bid criticism,business
1354,Russia gets investment blessing,business
1355,Karachi stocks hit historic high,business
1356,UK house prices dip in November,business
1357,Fannie Mae 'should restate books',business
1358,Saab to build Cadillacs in Sweden,business
1359,Millions go missing at China bank,business
1360,DaimlerChrysler's 2004 sales rise,business
1361,Air passengers win new EU rights,business
1362,Gold falls on IMF sale concerns,business
1363,Arsenal 'may seek full share listing',business
1364,Weak data buffets French economy,business
1365,'Standoff' on Deutsche's LSE bid,business
1366,Buyers snap up Jet Airways' shares,business
1367,Marsh executive in guilty plea,business
1368,BBC poll indicates economic gloom,business
1369,Industrial revival hope for Japan,business
1370,Nasdaq planning $100m-share sale,business
1371,Soros group warns of Kazakh close,business
1372,US interest rate rise expected,business
1373,Slowdown hits US factory growth,business
1374,Building giant in asbestos payout,business
1375,News Corp makes $5.4bn Fox offer,business
1376,Economy 'stronger than forecast',business
1377,Ethiopia's crop production up 24%,business
1378,Wal-Mart fights back at accusers,business
1379,US crude prices surge above $53,business
1380,BMW reveals new models pipeline,business
1381,Cuba winds back economic clock,business
1382,Peugeot deal boosts Mitsubishi,business
1383,Singapore growth at 8.1% in 2004,business
1384,Parmalat bank barred from suing,business
1385,Indian oil firm eyes Yukos assets,business
1386,SEC to rethink post-Enron rules,business
1387,Latin America sees strong growth,business
1388,Shares hit by MS drug suspension,business
1389,Jobs growth still slow in the US,business
1390,Yukos unit buyer faces loan claim,business
1391,Golden rule boost for Chancellor,business
1392,Yukos heading back to US courts,business
1393,MCI shareholder sues to stop bid,business
1394,France Telecom gets Orange boost,business
1395,Kraft cuts snack ads for children,business
1396,Budget Aston takes on Porsche,business
1397,Irish company hit by Iraqi report,business
1398,Asia quake increases poverty risk,business
1399,Ford gains from finance not cars,business
1400,India's Deccan gets more planes,business
1401,China keeps tight rein on credit,business
1402,Business fears over sluggish EU economy,business
1403,Parmalat sues 45 banks over crash,business
1404,Renault boss hails 'great year',business
1405,Oil rebounds from weather effect,business
1406,Monsanto fined $1.5m for bribery,business
1407,US bank in $515m SEC settlement,business
1408,Australia rates at four year high,business
1409,Madagascar completes currency switch,business
1410,Barclays profits hit record level,business
1411,'Post-Christmas lull' in lending,business
1412,German economy rebounds,business
1413,Small firms 'hit by rising costs',business
1414,Nissan names successor to Ghosn,business
1415,China continues rapid growth,business
1416,India power shares jump on debut,business
1417,SA unveils 'more for all' budget,business
1418,Nigeria to boost cocoa production,business
1419,Fiat mulls Ferrari market listing,business
1420,Cairn shares slump on oil setback,business
1421,Oil companies get Russian setback,business
1422,Fresh hope after Argentine crisis,business
1423,BMW to recall faulty diesel cars,business
1424,Bat spit drug firm goes to market,business
1425,French consumer spending rising,business
1426,Ore costs hit global steel firms,business
1427,Bombardier chief to leave company,business
1428,Iran budget seeks state sell-offs,business
1429,GM in crunch talks on Fiat future,business
1430,Parmalat to return to stockmarket,business
1431,Israeli economy picking up pace,business
1432,Turkey turns on the economic charm,business
1433,Deadline nears for Fiat-GM deal,business
1434,Japan bank shares up on link talk,business
1435,Profits stall at China's Lenovo,business
1436,Beijingers fume over parking fees,business
1437,Cars pull down US retail figures,business
1438,EU ministers to mull jet fuel tax,business
1439,Yukos bankruptcy 'not US matter',business
1440,China continues breakneck growth,business
1441,Industrial output falls in Japan,business
1442,Consumer spending lifts US growth,business
1443,Vodafone appoints new Japan boss,business
1444,UK bank seals South Korean deal,business
1445,Turkey-Iran mobile deal 'at risk',business
1446,Why few targets are better than many,business
1447,Japan's ageing workforce: built to last,business
1448,Enron bosses in $168m payout,business
1449,Asia shares defy post-quake gloom,business
1450,Indonesia 'declines debt freeze',business
1451,Saudi ministry to employ women,business
1452,US bank boss hails 'genius' Smith,business
1453,S Korean credit card firm rescued,business
1454,Boeing secures giant Japan order,business
1455,US trade deficit widens sharply,business
1456,Steel firm 'to cut' 45000 jobs,business
1457,US trade gap hits record in 2004,business
1458,LSE doubts boost bidders' shares,business
1459,Ryanair in $4bn Boeing plane deal,business
1460,India opens skies to competition,business
1461,Weak dollar hits Reuters,business
1462,US company admits Benin bribery,business
1463,Cactus diet deal for Phytopharm,business
1464,UK 'risks breaking golden rule',business
1465,Sluggish economy hits German jobs,business
1466,VW considers opening Indian plant,business
1467,House prices rebound says Halifax,business
1468,UK Coal plunges into deeper loss,business
1469,Strong demand triggers oil rally,business
1470,Profits jump at China's top bank,business
1471,Bank set to leave rates on hold,business
1472,GM issues 2005 profits warning,business
1473,Air Jamaica back in state control,business
1474,Winemaker rejects Foster's offer,business
1475,US interest rates increased to 2%,business
1476,Lacroix label bought by US firm,business
1477,Ad sales boost Time Warner profit,business
1478,EU-US seeking deal on air dispute,business
1479,Insurance bosses plead guilty,business
1480,Rescue hope for Borussia Dortmund,business
1481,Indy buys into India paper,business
1482,Burren awarded Egyptian contracts,business
1483,Orange colour clash set for court,business
1484,Tsunami to cost Sri Lanka $1.3bn,business
1485,Deutsche attacks Yukos case,business
1486,Mitsubishi in Peugeot link talks,business
1487,Bad weather hits Nestle sales,business
1488,India-Pakistan peace boosts trade,business
1489,GE sees 'excellent' world economy,business
1490,Electronics firms eye plasma deal,business
1491,Continental 'may run out of cash',business
1492,Algeria hit by further gas riots,business
1493,Mystery surrounds new Yukos owner,business
1494,Saudi NCCI's shares soar,business
1495,Brussels raps mobile call charges,business
1496,China bans new tobacco factories,business
1497,MG Rover China tie-up 'delayed',business
1498,Laura Ashley chief stepping down,business
1499,Winter freeze keeps oil above $50,business
1500,Circuit City gets takeover offer,business
1501,Car giant hit by Mercedes slump,business
1502,Train strike grips Buenos Aires,business
1503,ID theft surge hits US consumers,business
1504,US bank 'loses' customer details,business
1505,FAO warns on impact of subsidies,business
1506,Ex-Boeing director gets jail term,business
1507,Liberian economy starts to grow,business
1508,Beer giant swallows Russian firm,business
1509,UK homes hit £3.3 trillion total,business
1510,Google shares fall as staff sell,business
1511,Ask Jeeves tips online ad revival,business
1512,Reliance unit loses Anil Ambani,business
1513,McDonald's to sponsor MTV show,business
1514,US budget deficit to reach $368bn,business
1515,Turkey knocks six zeros off lira,business
1516,French suitor holds LSE meeting,business
1517,Krispy Kreme shares hit,business
1518,Saudi investor picks up the Savoy,business
1519,Call to save manufacturing jobs,business
1520,Chinese wine tempts Italy's Illva,business
1521,S Korean consumers spending again,business
1522,Bank payout to Pinochet victims,business
1523,Absa and Barclays talks continue,business
1524,Huge rush for Jet Airways shares,business
1525,UK interest rates held at 4.75%,business
1526,UK economy facing 'major risks',business
1527,Brazil jobless rate hits new low,business
1528,Europe blames US over weak dollar,business
1529,Yangtze Electric's profits double,business
1530,Quiksilver moves for Rossignol,business
1531,US data sparks inflation worries,business
1532,Call to overhaul UK state pension,business
1533,Singapore growth at 8.1% in 2004,business
1534,Mild winter drives US oil down 6%,business
1535,Disaster claims 'less than $10bn',business
1536,Court rejects $280bn tobacco case,business
1537,Business confidence dips in Japan,business
1538,US consumer confidence up,business
1539,Georgia plans hidden asset pardon,business
1540,Troubled Marsh under SEC scrutiny,business
1541,Manufacturing recovery 'slowing',business
1542,WorldCom bosses' $54m payout,business
1543,Watchdog probes Vivendi bond sale,business
1544,India widens access to telecoms,business
1545,China now top trader with Japan,business
1546,Libya takes $1bn in unfrozen funds,business
1547,Japanese banking battle at an end,business
1548,Ukraine trims privatisation check,business
1549,Millions 'to lose textile jobs',business
1550,Consumers drive French economy,business
1551,S Korean lender faces liquidation,business
1552,Lufthansa flies back to profit,business
1553,Macy's owner buys rival for $11bn,business
1554,Wall Street cool to eBay's profit,business
1555,EU 'too slow' on economic reforms,business
1556,Parmalat boasts doubled profits,business
1557,News Corp eyes video games market,business
1558,Egypt to sell off state-owned bank,business
1559,Telegraph newspapers axe 90 jobs,business
1560,Safety alert as GM recalls cars,business
1561,J&J agrees $25bn Guidant deal,business
1562,Call centre users 'lose patience',business
1563,US economy still growing says Fed,business
1564,BP surges ahead on high oil price,business
1565,Boeing unveils new 777 aircraft,business
1566,Umbro profits lifted by Euro 2004,business
1567,Man Utd to open books to Glazer,business
1568,Tokyo says deflation 'controlled',business
1569,Yukos drops banks from court bid,business
1570,Venezuela reviews foreign deals,business
1571,Yukos owner sues Russia for $28bn,business
1572,Markets fall on weak dollar fears,business
1573,Wal-Mart to pay $14m in gun suit,business
1574,G7 backs Africa debt relief plan,business
1575,Yukos loses US bankruptcy battle,business
1576,Ebbers denies WorldCom fraud,business
1577,Takeover rumour lifts Exel shares,business
1578,India's Reliance family feud heats up,business
1579,McDonald's boss Bell dies aged 44,business
1580,Rank 'set to sell off film unit',business
1581,US industrial output growth eases,business
1582,Bank opts to leave rates on hold,business
1583,Criminal probe on Citigroup deals,business
1584,Metlife buys up Citigroup insurer,business
1585,Nasdaq planning $100m share sale,business
1586,Dollar slides ahead of New Year,business
1587,Britannia members' £42m windfall,business
1588,Christmas shoppers flock to tills,business
1589,Israel looks to US for bank chief,business
1590,Giant waves damage S Asia economy,business
1591,Japan turns to beer alternatives,business
1592,EMI shares hit by profit warning,business
1593,House prices show slight increase,business
1594,Police detain Chinese milk bosses,business
1595,US firm 'bids for Lacroix label',business
1596,US adds more jobs than expected,business
1597,Businesses fail to plan for HIV,business
1598,Firms pump billions into pensions,business
1599,Japanese mogul arrested for fraud,business
1600,Five million Germans out of work,business
1601,US prepares for hybrid onslaught,business
1602,Strong quarterly growth for Nike,business
1603,GM pays $2bn to evade Fiat buyout,business
1604,Steady job growth continues in US,business
1605,WMC says Xstrata bid is too low,business
1606,Palestinian economy in decline,business
1607,BMW cash to fuel Mini production,business
1608,Asian quake hits European shares,business
1609,German business confidence slides,business
1610,Dollar hits new low versus euro,business
1611,S&N extends Indian beer venture,business
1612,Bush to outline 'toughest' budget,business
1613,Bank holds interest rate at 4.75%,business
1614,German growth goes into reverse,business
1615,Ukraine steel sell-off 'illegal',business
1616,India seeks to boost construction,business
1617,Cannabis hopes for drug firm,business
1618,Fed chief warning on US deficit,business
1619,Booming markets shed few tears,business
1620,GSK aims to stop Aids profiteers,business
1621,German jobless rate at new record,business
1622,Bush budget seeks deep cutbacks,business
1623,Water firm Suez in Argentina row,business
1624,Electrolux to export Europe jobs,business
1625,Golden rule 'intact' says ex-aide,business
1626,World leaders gather to face uncertainty,business
1627,Survey confirms property slowdown,business
1628,HealthSouth ex-boss goes on trial,business
1629,India unveils anti-poverty budget,business
1630,US Ahold suppliers face charges,business
1631,Jobs growth still slow in the US,business
1632,Gaming firm to sell UK dog tracks,business
1633,Wipro beats forecasts once again,business
1634,M&S cuts prices by average of 24%,business
1635,Standard Life concern at LSE bid,business
1636,Jobs go at Oracle after takeover,business
1637,Winn-Dixie files for bankruptcy,business
1638,Fed warns of more US rate rises,business
1639,News Corp eyes video games market,business
1640,Dollar hovers around record lows,business
1641,Market unfazed by Aurora setback,business
1642,Green reports shun supply chain,business
1643,EU aiming to fuel development aid,business
1644,Could Yukos be a blessing in disguise?,business
1645,MCI shares climb on takeover bid,business
1646,Worldcom ex-boss launches defence,business
1647,Quake's economic costs emerging,business
1648,Chinese dam firm 'defies Beijing',business
1649,Jarvis sells Tube stake to Spain,business
1650,Iranian MPs threaten mobile deal,business
1651,Feta cheese battle reaches court,business
1652,Malaysia lifts Islamic bank limit,business
1653,Qantas considers offshore option,business
1654,Yukos unit fetches $9bn at auction,business
1655,Mixed Christmas for US retailers,business
1656,Argentina closes $102.6bn debt swap,business
1657,House prices drop as sales slow,business
1658,Qantas sees profits fly to record,business
1659,Khodorkovsky quits Yukos shares,business
1660,Salary scandal in Cameroon,business
1661,Novartis hits acquisition trail,business
1662,Asian banks halt dollar's slide,business
1663,Argentina Venezuela in oil deal,business
1664,Brazil buy boosts Belgium's Inbev,business
1665,Gazprom 'in $36m back-tax claim',business
1666,Virgin Blue shares plummet 20%,business
1667,Verizon 'seals takeover of MCI',business
1668,Oil prices fall back from highs,business
1669,US to rule on Yukos refuge call,business
1670,Delta cuts fares in survival plan,business
1671,Split-caps pay £194m compensation,business
1672,$1m payoff for former Shell boss,business
1673,Chinese exports rise 25% in 2004,business
1674,Brewers' profits lose their fizz,business
1675,UK firm faces Venezuelan land row,business
1676,Venezuela identifies 'idle' farms,business
1677,Soaring oil 'hits world economy',business
1678,US regulator to rule on pain drug,business
1679,No seasonal lift for house market,business
1680,Ericsson sees earnings improve,business
1681,Yukos seeks court action on sale,business
1682,Honda wins China copyright ruling,business
1683,German bidder in talks with LSE,business
1684,Giving financial gifts to children,business
1685,Parmalat founder offers apology,business
1686,Brazil approves bankruptcy reform,business
1687,Deutsche Boerse set to 'woo' LSE,business
1688,Steady job growth continues in US,business
1689,Trade gap narrows as exports rise,business
1690,Fiat chief takes steering wheel,business
1691,Lesotho textile workers lose jobs,business
1692,Aids and climate top Davos agenda,business
1693,US gives foreign firms extra time,business
1694,'Golden economic period' to end,business
1695,Rover deal 'may cost 2000 jobs',business
1696,Hariri killing hits Beirut shares,business
